Date,title
2021-01-06,증권가 지금 사도 되나 문의 계속 차 머니무브 시발점 될 듯 코스피  시대
2021-01-06,대학생대학원생은  할인해드려요
2021-01-06,코스피 주역은 역시 동학개미 해냈다
2021-01-06,향후 주도주는 반도체전기차차전지
2021-01-06,이재용 새해 현장 경영 광폭행보반도체 사업전략 점검
2021-01-06,코스피 선 등락동학개미 조 순매수
2021-01-06,코스피  증시 년년 만에  벗어나
2021-01-06,코로나로 길어지는 집콕 쏟아지는 이색가전
2021-01-06,코스피  시대 반도체 끌고인터넷배터리바이오 밀고
2021-01-06,대구창조경제혁신센터 육성기업 개사  빛낸다
2021-01-06,코스피 시대한국 증시가 달라졌어요
2021-01-06,반도체 랠리 삼전하이닉스 나흘째 동반 상승
2021-01-06,김범준  교수 내구성경제성 뛰어난 연료전지 개발이달의 과학기술인상
2021-01-06,김진욱 후보자는 왜 지인 회사 바이오주에 몰빵했을까
2021-01-06,바이오배터리인터넷플랫폼산업구조 신성장 재편이 증시 불지펴
2021-01-06,세계 최초  롤러블폰 서 맛보기 등장
2021-01-06,코로나 경제 위기 디지털 뉴딜로 극복 조 판 깔린다종합
2021-01-06,단독 화웨이  첫 불참 결정 존재감 사라지는 가전쇼
2021-01-06,부당노동행위 고소당한 트윈타워 관리업체근로감독관 조사도 방해했다
2021-01-06,특징주국내증시 시총 위 모두 신고가 경신
2021-01-06,천 찍은 코스피주린이가 상승장 불붙였다고 이지효의 플러스 
2021-01-06,코스피 년 만에 새 역사처음 가보는 길
2021-01-06,피할 수 없는 현실 된 경영 기업 생존과 직결
2021-01-06,코스피시대삼천피 넘은 코스피 삼이피 삼삼피 가능할까
2021-01-06,유플러스 임직원 명   참관신사업 발굴한다
2021-01-06,코스피  시대 증시 새로운 길을 밟다
2021-01-06,이젠 매출액 대신 사회를 말한다달라진 기업 신년회
2021-01-06,소리 내고 휘는 패널 화질 끝판왕  일상의 혁신
2021-01-06,  가 건물 출입자 발열 체크하고 마스크 써도 본인 확인 가능
2021-01-06,  에 여명 참관신사업 발굴
2021-01-06,매일경제해피칼리지   디브리핑 세미나 온라인 라이브로
2021-01-06,개인 빚투 조 육박 실물경제 괴리된 유동성 함정 우려
2021-01-06,맘카페단톡방도 주식 주식 상투 위험에도 조 실탄 장전
2021-01-06,코스피  시대 개막 향후 주도주는 반도체전기차차전지
2021-01-06,유플러스  서 신사업 찾는다임직원 명 참관
2021-01-06,아이폰 미니 미국선 찬밥 신세왜
2021-01-06,조국 부부 입시비리울산시장 선거개입 재판 코로나로 연기
2021-01-06,코스피 장중 사상 첫  돌파외국인기관 매도로 선 하락마감
2021-01-06,거인 서정진 셀트리온 회장이 남긴 대 발자취
2021-01-06,코스피  사수하라장중 지수 선 떨어지자  쏘는 개미
2021-01-06,  에 여명 임직원 투입신사업기회 찾는다
2021-01-06,유플러스   대규모 참관신사업 발굴 나선다
2021-01-06,곽인찬의 특급논설 이재용의 길 카네기 발렌베리
2021-01-06, 온라인으로 만나는  올해 떠오르는 주요 화두는
2021-01-06,대통령 내일  신년인사회경제계 신년인사회는 올해도 불참할 듯
2021-01-06,언팩 앞두고개월된 갤럭시폴드 지원금도 상향 최대 만원
2021-01-06,주식시장 열린 지 년만에 코스피 포인트 시대 개막
2021-01-06,유플러스 신사업 발굴 위해   명 참관
2021-01-06,코스피 천 시대강산이 네 번 바뀌었다
2021-01-06, 임직원 명  온라인 참관신사업 발굴
2021-01-06,  에서 신사업 발굴 나선다임직원 여명 참관
2021-01-06,글로벌기술센터 점검하는 이재용 부회장
2021-01-06,코로나로 촉발된 가전의 진화 위생인테리어홈엔터가 키워드 가전으로 내 집을 사무실극장처럼
2021-01-06,전기차 한 번 충전에 ㎞ 가는 전고체 배터리 도요타 상용화 선전포고에 국내 기업 발등에 불
2021-01-06,장중 사상 첫  돌파한 코스피 대로 마감
2021-01-06,코스피 외인기관 매도에 선 하회보합권 등락
2021-01-06,새해에 반도체 빅사이클 온다 수요 느는데 재고 스마트폰 시장 회복 호재 여전한 코로나 위험 미중 무역갈등 변수
2021-01-06,온라인으로 선보일 미래 기술코로나 이후 일상이 펼쳐진다
2021-01-06,유플러스 신사업 발굴 위해  대규모 참관
2021-01-06,   온라인 명 배치신사업 발굴 집중
2021-01-06,코스피  흥행 드라마주연은 동학개미
2021-01-06,매경이 전하는 세상의 지식 매세지 월 일
2021-01-06,신사업 찾아라    임직원 명 참관
2021-01-06,네트워크장비 생산라인 점검 나선 이재용 부회장
2021-01-06,시가총액 위 주식 일제히 신고가
2021-01-06,개인 조 사자에도   하락하이닉스는 또 신고가종합
2021-01-06,상속세 들여다보는 정부세율 인하는 쉽지 않을 듯
2021-01-06,이재용 연초부터 현장경영 잰걸음반도체 이어 네트워크
2021-01-06,미리보는  온라인으로 새 방향 제시비대면비접촉 기술 주목
2021-01-06,코스피 장중 사상 첫  고지 찍었다
2021-01-06,진격의 코스피증권사들 까지 간다
2021-01-06,마감시황코스피 선 돌파 후 되밀려개인 역대급 매수
2021-01-06,동학개미 힘으로 불안한 황소장 뉴스분석
2021-01-06,코스피 사상 첫 장중  돌파새 역사 썼다
2021-01-06,코로나 여파 조국백원우 재판 등 연기월 중 공지
2021-01-06,조선철강금융반도체차전지시총 지도 확 바뀌었다
2021-01-06,코스피 코스피 이번엔 실적이 떠받친다
2021-01-06, 임직원 명   참관신사업 발굴
2021-01-06,동학개미 우리가 옳았다 환호성지금이라도 들어갈까 고민도
2021-01-06,코스피 선 돌파 후 숨고르기
2021-01-06,이재용 연초부터 광폭 현장경영미래 준비 사회 기여에 방점
2021-01-06,정원석 교수 논문 네이처 게재 자폐증조현병 치료 새 지평 열어
2021-01-06,동학개미 이끈 코스피 꿈의  돌파
2021-01-06,코스피 선 뚫었다  반락최고치 행진 멈춰
2021-01-06,신사업 찾아라찐팬 확보 나선다    임직원 명 참관
2021-01-06,코스피  새해 거래일만에 천장 뚫었다최대  간다
2021-01-06,증시 시대 코스피 새역사 썼다년 상승 일지
2021-01-06,코로나 때문에조국송철호이재용 재판 줄줄이 연기
2021-01-06,사상 첫 코스피  맛만 본 동학개미 조 넘게 샀지만 하락 마감 종합
2021-01-06,만만한게 폰 ㅠㅠ 넷플릭스의 갑질 선빵
2021-01-06,서 비즈니스 기회 찾자 명 참관단 꾸려
2021-01-06,유플러스 온라인  에서 신사업 발굴임직원 명 참관
2021-01-06,청춘동행에 담긴 년 스토리돌봄 방향타
2021-01-06,조국울산시장 선거개입 재판 코로나로 연기
2021-01-06,신사업 찾자 황현식  올해 에 임직원 명 참관
2021-01-06,조국선거개입 재판도 코로나로 줄줄이 연기내달 일정 재공지
2021-01-06,화성시 시립아동청소년센터 성과집 청춘동행 발간
2021-01-06,코스피  시대 개막 진정한 랠리인가 유동성 함정인가
2021-01-06,코스피  새 지평 연 증시 거품 논란은 아직 일러
2021-01-06,이원욱  시행 탄소중립시기 앞당길 수 있어
2021-01-06,밸류에이션 높아진 증시덜오른 중소형가치주 빛보나
2021-01-06,화성소식중소벤처기업부 백년가게 발굴육성 추진 등
2021-01-06,오후 주식시장은코스피  찍고 시간만에 반전등락 거듭
2021-01-06,속보 코스피 사상 첫  돌파포인트까지 올라서
2021-01-06, 대형  속도 조절  성장 둔화 우려
2021-01-06,비트코인 상승장 투자자 정보균형 절실
2021-01-06,선 돌파 후 요동치는 코스피장중 선까지 하락 후 반등
2021-01-06,수원사업장 방문한 이재용 부회장
2021-01-06,롤러블  에서 미리보기단말기 일부분 티저 영상
2021-01-06,사상 첫 코스피  시대 열렸다장중 선 돌파 대 강세
2021-01-06,교보증권 주식 선물하고 경품 받아가세요
2021-01-06,국제트렌드포스 화웨이 올해 스마트폰 시장 위 전망
2021-01-06, 연구 센터 찾은 이재용 미래기술 확보는 생존 문제
2021-01-06,글로벌기술센터 점검하는 이재용 부회장
2021-01-06,올해 디스플레이 시장 패널 활용도 대폭 확대 기대
2021-01-06,이재용 부회장 중장기 전략 점검 현장방문
2021-01-06,포스트 코로나 시대 반도체 화두로
2021-01-06,제재로 스마트폰 사업 어려운 화웨이  첫 불참 결정
2021-01-06,오후시황코스피 선 돌파 뒤 기관외인 매도에 하락세
2021-01-06,부음
2021-01-06,실적까지 탄탄올해 최상단 종합
2021-01-06,더 뜨거워진 개미의 주식 열풍올해 가치주 전성시대 오나
2021-01-06,가상자산 소문 말고 데이터 토대로 투자해야 이사람
2021-01-06,동탄 테크노밸리 내 동탄아너스카이 분양
2021-01-06,스마트폰 버리고 자동차용  회사로 변신한 블랙베리
2021-01-06,기자수첩 코스피 에도 마냥 웃을 수 없는 이유
2021-01-06,코스피 시대 열렸다동학개미의 힘
2021-01-06,빅데이터일 오전 주식시장 심리 단계 매우 좋음
2021-01-06,코스피 시대 시총 상위 종목 줄줄이 강세 동학개미 견인차
2021-01-06,마감시황코스피 사상 첫 선 찍고 하락 마감
2021-01-06,코스피 시대 증권가 리서치센터장들 톱픽은
2021-01-06,대망의 코스피 시대등 공신은 코로나
2021-01-06,더 세지고 똑똑해진 동학개미가 주역
2021-01-06, 찍은 코스피 선 후퇴거침없는 동학개미 조 순매수
2021-01-06,재계 블로그 주가 롤러코스터 천종윤 위기 돌파 카드는
2021-01-06,코스피  돌파 후 다시 장중 선대까지 출렁상승분 반납
2021-01-06,코스피  시대 개막 확바뀐 시총 지도조선철강금융에서 반도체 차전지 인터넷으로
2021-01-06,팀장시각 연승의 쾌감첫 패배의 후유증
2021-01-06,구치소 집단감염으로 미결수 재판 잇달아 연기 불구속 재판 확대될까
2021-01-06,폭등장서 게걸음 통신미래 주가는  손에 포트라이트
2021-01-06,코스피  시대 동학개미 덕에 새역사 썼다
2021-01-06, 일본에 반도체 패키징테스트 공장 설립하나대만 언론 보도
2021-01-06,단독반도체 전시회 세미콘 코리아 올해도 취소온라인으로
2021-01-06,로이터 한국 코스피  개인이 년 박스피 깨뜨려
2021-01-06,기재부 경유세부동산세제 강화 계획 없어상속세 인하는 공감대 있어야
2021-01-06,개인 조 매수에도 기관 팔자에 힘 빠진 코스피  마감
2021-01-06,부고
2021-01-06,폭등장서 옆걸음 통신 주목할 때
2021-01-06,가입자는 모아야겠고 방통위는 무섭고 고의 개통지연 의혹
2021-01-06,폭등장서 게걸음 통신 재평가는 시간문제
2021-01-06,코스피  시대 개막 동학개미가 이끈 신기원증권사들 코스피 더 간다
2021-01-06, 찍은 코스피 하락 마감일일 거래대금 최고치 재경신
2021-01-06,부고 박찬술씨 별세 외
2021-01-06,마감시황선 돌파한 코스피 로 후퇴 마감개미들 조 넘게 매수
2021-01-06,코로나 위기 속 전남 특성화고마이스터고 취업 얼마나 했나
2021-01-06,오전시황코스피 사상 첫 선 돌파개인 상승세 주도
2021-01-06,부음 박무성더불어민주당 금정구지역위원장씨 부친상 
2021-01-06,년 스마트폰 년 복귀코로나파운드리 생산부족 변수
2021-01-06,부고김국진 별세조성철 사단법인 대한모터스포츠협회 회장아사애드 대표 모친상 
2021-01-07,삼성전자 미니   네오  베일 벗었다세계 시장 첫선
2021-01-07, 진화    엄청나네삼성 퍼스트룩서 최초 공개
2021-01-07,삼성 네오    미니   시장 열렸다
2021-01-07,  삼성전자    마이크로  전격 공개
2021-01-07,갤럭시 만원 파격가삼성 전략폰 승부수
2021-01-07,팔만전자 끌고 하이닉스 밀고시총 톱 조 넘어
2021-01-07,삼성 년만에   브랜드 꺼냈다
2021-01-07,삼성전자 년형   
2021-01-07,삼성 만전자 이어  만화학 눈앞차화전 신고가 속출
2021-01-07,삼성 퍼스트 룩 
2021-01-07,사상 첫 온라인  닷새 앞삼성 필두 한국 기업들 출사표
2021-01-07,삼성전자 하만   공개차안의 새로운 경험
2021-01-07,이재용 미래기술은 생존 문제 삼성 몇백배 책임감 갖자
2021-01-07,애플빠 일본인 삼성폰은 싼 맛에 산다 선빵
2021-01-07,신년 덕담하는 이인용 삼성전자 사장
2021-01-07,삼성하이닉스 분기 실적 전망 좋다
2021-01-07,삼성 갤럭시 출고가 만원대 유력전작보다 만원 저렴
2021-01-07,삼성 퀀텀 미니  적용    공개
2021-01-07,삼성 퍼스트 룩  키워드는 환경사람 강조한 스크린 포 올
2021-01-07,코아시아하나텍 맞손삼성 파운드리  생태계 구축
2021-01-07,전자 주일만에 또 깜짝  알폰소 억에 인수
2021-01-07,삼성전자의 년형 네오  
2021-01-07,대학생 모여라삼성애플 신학기 앞두고 할인 경쟁
2021-01-07,증시 시대만전자만닉스 찍나
2021-01-07,갤럭시 오는 일부터 예판삼성이통사 사전알림 신청
2021-01-07,삼성 갤럭시  국내 출고가 만원으로 확정
2021-01-07,테스 삼성전자와 억원 규모 반도체 제조장비 계약 체결
2021-01-07,디아이 삼성전자와 억규모 반도체 검사보드 공급계약
2021-01-07,삼성전자 내일 잠정실적 발표 분기도 호실적 릴레이
2021-01-07,퍼스트룩 네오마이크로라이프스타일 삼각편대 공개삼성 년 연속 위 시동
2021-01-07, 테크기상도 코로나 붐업  시장 글로벌 절반이 삼성새해  격차 더 벌린다
2021-01-07,한종희 삼성전자 사장 새 비전 스크린 포 올   제시
2021-01-07,삼성 퍼스트 룩 
2021-01-07,삼성디스플레이  브랜드 재편삼성 일원화
2021-01-07,삼성     공개 분의  크기 퀀텀 미니  적용
2021-01-07,신년 덕담하는 이인용 삼성전자 사장
2021-01-07,과거 개미들과 달라세대가 삼성전자 산 이유
2021-01-07,전자랜드 년 대형가전 온라인 구매 늘었다
2021-01-07,한종희 삼성전자 사장 사람 중심지속 가능에 초점스크린 포 올 비전 제시
2021-01-07,특징주코아시아 삼성전자  역량 강화에 강세
2021-01-07,삼성전자 년형   
2021-01-07,삼성폰 기반 초등생 전용폰 카카오리틀프렌즈폰 출시
2021-01-07,삼성전자 미니  네오  공개 분기 글로벌 출격
2021-01-07,삼성전자 일부터 갤럭시  사전예약 가격은
2021-01-07,전자랜드 지난해 대형가전 온라인 구매 늘었다
2021-01-07,삼성전자 년형   
2021-01-07,오포샤오미구글 폴더블폰 만든다삼성 삼성전자 의존도
2021-01-07,삼성 퍼스트 룩  개최
2021-01-07,전자랜드 년 대형가전 온라인 구매 늘었다
2021-01-07,삼성전자  신제품과 전략 설명하는 한종희 사장
2021-01-07,삼성의 년 신제품   를 소개합니다
2021-01-07,갤럭시 출고가 만원대가격 승부수 띄운 삼성
2021-01-07,상위 대 기업 년전보다 시총 조 증가전자 주목
2021-01-07,빅데이터시장심리 톱 삼성전자카카오대우건설이노베이션
2021-01-07,포토신년 덕담하는 이인용 삼성전자 사장
2021-01-07,시총 상위 대 기업 년새 조원 전자 주목
2021-01-07,삼성 평택 공장에 산업용가스외국계 점령시장서 토종의 힘
2021-01-07,삼성전자 갤럭시 출고가 만원 이하 승부수
2021-01-07,와인추천부터 나의 아바타까지삼성 랩 아이디어 세계인 무대로
2021-01-07,퍼스트룩 한종희 사장 삼성 업계 최초 고잉 그린 선언순환경제 선도
2021-01-07, 삼성전자 달리자 하이텍도 
2021-01-07,삼성 주도 미니  시장 새 키워드 부상
2021-01-07,안건준 벤처기업협회장 이재용 삼성전자 부회장 탄원서 제출
2021-01-07,알파홀딩스 삼성전자 시스템 반도체 성장 강조 수혜 급등
2021-01-07,세대 동학개미 삼성전자 주식 산 이유는
2021-01-07,코아시아 삼성전자 디자인 솔루션 파트너사 긍정적하나
2021-01-07,라씨로 삼성 엔씨소프트 목표가 만원 제시
2021-01-07,특징주 삼성전자 장중 만원개인 사자에 상승세
2021-01-07,삼성전자 비스포크 가전 년반만에 만대 판매
2021-01-07,집콕에 식기세척기 판매  증가삼성 파전
2021-01-07,금감원 이달 삼성증권 종합검사 착수
2021-01-07,디아이 삼성전자와 억 규모 반도체 검사보드 공급계약
2021-01-07,디아이 삼성전자와 억 규모 반도체 검사보드 공급계약
2021-01-07,테스 삼성전자와 억 규모 반도체 제조장비 공급계약
2021-01-07,사설전자산업 소프트파워 보강하자
2021-01-07,삼성 자회사들 나란히 대표 교체
2021-01-07,공진단월일 공시진단 리뷰전자
2021-01-07,코로나 충격 산업 인재로 돌파한다삼성 신성장분야 육성  인재기술력 완비
2021-01-07,매장 방문 대형가전도 온라인으로 산다
2021-01-07,갤럭시 가격 만원 밑으로 플래그십 최초
2021-01-07,위기에 빛났던 코스피신기록 쏟아내며 삼천피 안착
2021-01-07,코스피 종가 기준 첫  돌파  마감
2021-01-07,시총 상위 개 종목 년만에 조 껑충
2021-01-07,편의점에서 집도 판다올해 설 선물은 플렉스
2021-01-07,코스피 종가 기준 첫  돌파오늘은 기관 매수세종합보
2021-01-07,코스피 종가 삼천피 역사 시작된다종합
2021-01-07,새해 대 기업 시총 천조원년 전보다  증가
2021-01-07,대 그룹  큰 그림 그렸다
2021-01-07,대형가전도 온라인 구매 고객
2021-01-07,갤럭시 가격 만원 아래로  플래그십 최초
2021-01-07,코스피  안착차화전이 이끈다종합
2021-01-07,최태원  회장 대한상의 회장 맡을 듯대그룹 총수 중 처음
2021-01-07,박용만 년에서 년 앞을 내다보고 경제적 선택 고민해야
2021-01-07,경제계 신년인사회박용만 경제 년 년 내다보고 대처해야종합
2021-01-07,몸값 낮추는 갤럭시만천원대 유력종합
2021-01-07,유플러스 카카오리틀프렌즈폰 출시자녀 보호기능 강화
2021-01-07,세대 대형가전도 온라인에서 산다
2021-01-07,갤 울트라 전용 펜노트 펜과 차이점은
2021-01-07,박용만 년 앞을 내다보는 경제적 선택을기업지원 틀 마련도종합
2021-01-07, 넘어선  선점 경쟁 본격화 확장현실플라잉카 일상이 된다
2021-01-07,베일벗은 네오  프리미엄 왕좌 노린다
2021-01-07,경제계 신년인사회박용만 코로나로 인한 경제충격 대비해야
2021-01-07,연초부터 신고가 랠리 대형주가 증시 끌어올렸다
2021-01-07,대 기업 시총지난해만 조 늘었다
2021-01-07, 한종희 사장 수어로 제어하는 기술 선보일 것
2021-01-07,가격 내리고 펜 탑재한 갤아이폰 잡고 부진 만회하나
2021-01-07,박용만 경제 낙관 말고 년 내다봐야경제계 신년인사회
2021-01-07, 설 선물 판매 개시최고 만원 이동형 주택도
2021-01-07,갤  플래그십폰 최초로 만원 하회만원대 유력
2021-01-07,박용만 신년 인사회서 정치권에 쓴 소리정치경제 이슈 명확히 구분해야
2021-01-07,이데일리 대한상의 차기 회장에 최태원  회장 단독 추대 
2021-01-07,대형가전도 앱으로냉장고 대 중 대는 온라인 구매
2021-01-07,코스피 마감기관이 매수 바톤 올라 선 안착
2021-01-07,블루웨이브 타고 삼천피 안착 가고 차화전 왔다
2021-01-07,대명아임레디 대명 스마트라이프 이벤트
2021-01-07,줌인다음주 공개 갤럭시 모든것 폰 주도권 회복해라
2021-01-07,경제계 신년인사회 박용만 경제 낙관 말고 년 앞을 내다봐야
2021-01-07,코스피  시대 동학개미 내다판 종목은
2021-01-07,최태원  회장 대한상의 차기 회장 유력다음달 단독 추대 예상
2021-01-07,경제계 신년인사회서 규제 완화 호소 대통령은 년째 불참종합
2021-01-07,네오   출격 가 저화질도 로 바꿔준다 미리보는  
2021-01-07,첨단기술 경연장 미  일 개막사상 첫 온라인행사
2021-01-07,포스트 코로나 경제반등 다짐경제계 신년인사회서 한 뜻 모아
2021-01-07,이재용 미래사업 발굴은 책무 사흘 연속 현장경영
2021-01-07,편의점서 집도 살 수 있다 업계 첫 이동형 주택 판매
2021-01-07,코스피  유망업종은 반도체배터리친환경 뜬다
2021-01-07,코스피 이틀 연속 최고치 갱신장 중 선 터치
2021-01-07,폰갤갤까지진짜 싸게 팝니다 ㅠㅠ 선빵
2021-01-07,동학개미의 끊임없는  러브콜새해 조 넘게 담았다
2021-01-07,증시  시대 등 공신 개미의 기록
2021-01-07,대형주가 끌어올리는 국내 증시연일 신고가 랠리
2021-01-07,하이닉스 시총 조 돌파 등  버린다
2021-01-07,설 선물로 집을편의점에 등장한 천만원대 이동형 주택
2021-01-07,주식 초고수는 지금한화솔루션인트론바이오 매매 활발
2021-01-07,코아시아하나텍 시스템반도체 기술 및 사업협력 모델 구축
2021-01-07,반도체 실적에 성장성까지 달았다
2021-01-07,올 설에는 집을 선물하세요 만원짜리 이동형 주택 등장
2021-01-07,박용만 코로나 이후 출구전략 마련해야경제계 신년인사회 개최
2021-01-07,코아시아 하나텍과 시스템반도체 기술 및 사업협력 모델 구축
2021-01-07,무인자율선박 롤러블폰 올해도 세상 바꿀 신기술 모였다
2021-01-07,최태원 상의 회장 맡을 듯대 그룹 총수로는 처음
2021-01-07,개인 조 팔자에도 코스피 대 올라선
2021-01-07,최태원  회장 대한상의 회장 단독 추대 임박
2021-01-07,대명아임레디 새해 선물 주는 대명 스마트라이프 이벤트 진행
2021-01-07,에서 까지 사연 많은 코스피년 톱 지킨 국민주는
2021-01-07,경제계 신년인사회박용만 기업활동의 자유와 지원의 틀을 마련해야
2021-01-07,제니폰 갤럭시 출시전 갤럭시노트노트 울트라 특가 이벤트 진행
2021-01-07,소니의 자율주행 전기차가 유망한 가지 이유 최원석의 디코드
2021-01-07,퇴근길 도 세계최초 가즈아원천기술 확보에 억 투입
2021-01-07,대명아임레디 새해 선물 증정 대명 스마트라이프 이벤트
2021-01-07,정밀한 빛 조절 초고화질 사람 중심 기술친환경 구현
2021-01-07,국립대구과학관 년 대한민국 산업과학기술사연구 주요인물 인 선정
2021-01-07,온라인 개최 앞둔  관련주는
2021-01-07,달라진 개미작년 순매수 조 중 조가 똘똘한 대표주
2021-01-07,이것이 퀀텀 미니  적용된   
2021-01-07,마켓뷰 코스피 종가  돌파차화전 랠리가 상승 이끌어
2021-01-07,올해  키워드 디지털 시티로 도시 전체가 언택트
2021-01-07,코스피 종가 첫 상반기  희망가
2021-01-07,전열 정비마치고대그룹 오너주 새해 증시 이끈다
2021-01-07,김진욱 위장전입 의혹 지적에 청문회 때 사과할 것
2021-01-07,하이닉스 시총 조 돌파 등  버리고 업계 선도
2021-01-07,코스피 잔칫날 운 업종도 많았다
2021-01-07,클릭 종목삼전 파운드리 사업부에서  역할 중요성 증가코아시아 관심
2021-01-07,사흘간 조 불개미 증시 열렸다 닫힌 
2021-01-07,출시 한참 남았는데갤폴드노트 렌더링 벌써 등장
2021-01-07,잘나가는 기업들 보너스 축포회사 다닐 맛 나네
2021-01-07,충전기 뺀 샤오미레이쥔 애플 따라했다고 원래 내 아이디어
2021-01-07,반도체 소부장도 붉은색 미소
2021-01-07,스마트폰 만원 시대 코앞정부 스마트폰값 잡겠다지만 글쎄
2021-01-07,비트코인 오르자 자취 감춘 엔비디아 공급 확대 난항
2021-01-07,기관외국인도 사자 합류 코스피 시대 열었다
2021-01-07,코스피  사수하라개미  투하
2021-01-07,유출된 폴드 렌더링 이미지 펜 있어없어
2021-01-07,수어로  제어모두 위한 스크린 만들것 미리보는  
2021-01-07,단기 조정  영향 미미 재개 앞둔 공매도 변수
2021-01-07,장 중 기업공시월 일
2021-01-07,미래산업  반도체 슈퍼사이클 맞아 초격차 속도
2021-01-07,실적 든든  간다 조정 대비  분산을
2021-01-07,외국인기관 조원 매수 코스피 선 돌파
2021-01-07,최태원  회장 대한상의 회장 맡을 듯내달 초 단독 추대
2021-01-07,포스트코로나 시대의 기업 성장 전략 스타트업에게 물어보자 부
2021-01-07,차산업바이오친환경 주목하라 변수는 코로나
2021-01-07,의자까지 최고급으로 바꿨다 게임 제대로 즐기려고
2021-01-07,포스트코로나 시대의 기업 성장 전략 스타트업에게 물어보자 부
2021-01-07,유플러스 카카오리틀프렌즈폰 출시
2021-01-07,일상을 바꾸는 새 기술 들고  문 두드리는 국내기업들
2021-01-07,최경선 칼럼 유영민 비서실장 무엇이 다를까
2021-01-07,미니   롤러블폰 로봇 자율주행  관전포인트
2021-01-07,이것이  
2021-01-07,대한상의 회장 맡는 최태원 대 그룹 총수로는 최초
