Date,title
2021-01-24,가짜 이재용 옥중서신 애초에 성립 불가오류투성이로 판명
2021-01-24,억 계좌  만원 계좌  주식 수익률 실탄이 갈랐다
2021-01-24,분기 어닝시즌 코스피 영업이익  증가올 분기  
2021-01-24,불붙은 대형주 강세장 언제까지 갈까
2021-01-24,올림픽 특수 또 놓칠라도쿄올림픽 취소론에 업계 촉각
2021-01-24,올해 대세는 미니  주목할 관련는
2021-01-24,갤럭시워치 혈당까지 측정한다 애플워치도 적용
2021-01-24,자율주행시대 열리지만 대당 반도체 개반도체 품귀 심해질 것
2021-01-24,코로나 뚫고 유럽 누볐는데또 멈춘 이재용의 글로벌 행보
2021-01-24,개미의 쏠림은 또 하나의 변동성
2021-01-24,삼기도문 외던 동학개미  러브콜 시들해졌나
2021-01-24,동학개미가 밀고 대형주가 끌고강력한 월 효과 나올까
2021-01-24,애플 배만 불렸다 쇠락 폰 후폭풍단통법 대수술 예고 선빵
2021-01-24,갤 위믹스폰 출시가상자산 최대 만원 지급
2021-01-24,갤 전작 대비  판매 늘어첫날 약 만대
2021-01-24,틈새에서 주류로빌트인 정수기 뜬다
2021-01-24,김정현의 유출선넘었다김샌 언팩 만든 유출의 경제학
2021-01-24,갤럭시  디자인 깔끔카메라 성능 탁월 무거운 것이 흠
2021-01-24,정부 소부장 대 핵심전략품목 실증 테스트베드 구축
2021-01-24,대그룹 반도체전기차로 날았다새해 시총  돌파
2021-01-24,미리보는 이데일리 신문 일자리 밀려난 청년 탁상대책이 더 아프다
2021-01-24,공매도 재개되도 대형 주가 영향 없을 것
2021-01-24,박범계 인사청문회 여야 난타전 예고이번주일일 주요일정
2021-01-24,개미 죽이는 연기금 매도행진 멈춰라 사든 팔든 알아서 할 일
2021-01-24,증시캘린더이번주월 주 선진뷰티사이언스 등 코스닥 신규 상장
2021-01-24,단독 애플 강국 한국에 손짓스노우 같은 대박 앱 또 만들자
2021-01-24,외국인 한 주만에 사자 전환네이버 가장 많이 순매수
2021-01-24,삼성 무풍에어컨 신제품비스포크 디자인에  관리기능
2021-01-24,삼성본사 이전 언급한 이재용 옥중회견문은 가짜였다
2021-01-24,삼성전자전자 이번주 확정실적 발표지난해 사업부별 성적표는
2021-01-24,삼성 지난해 반도체 영업익 조로 글로벌 위위 인텔위 에 밀려
2021-01-24,삼성전자 년형 무풍에어컨 출시
2021-01-24, 언론들 삼성 미국에 반도체공장 건설 검토 배경은
2021-01-24,코스피 주간 개인 순매수 위 삼성전자
2021-01-24,투자 집중되는 반도체 장비 업계원익 삼성이 가면 나도 간다
2021-01-24,갤럭시 전작 뛰어 넘었다흥행 청신호
2021-01-24,재벌 총수 수감기간 주가 대부분 코스피보다 상승
2021-01-24,주간증시전망대형주 실적 시즌 온다
2021-01-24,역대 재벌총수 수감기간 주가 대부분 코스피보다 더 올라
2021-01-24,부동산 큰손도 증시로 대이동
2021-01-24,갤럭시 이틀새 만대전작 대비 
2021-01-24,분기 어닝시즌 상장사 영업익  상승 예상
2021-01-24,아이폰에 밀린 자존심 회복할까갤 흥행 중요한 이유
2021-01-24,팩트체크이재용 옥중 회견문애초에 전달도 불가
2021-01-24,이재용 가짜 옥중서신 해프닝 말도 안되는 허점투성이 판명
2021-01-24,쾌조의 스타트갤럭시 첫날 개통량 보다 
2021-01-24,분기 실적 시즌 본격 시작 에도 눈길
2021-01-24,박영선  승인 저용량주사기 부족에  갖고 있다
2021-01-24,주간증시전망 변수대형주테슬라 실적 주목
2021-01-24,재벌 총수 감옥 가면 주가엔 호재
2021-01-24,소부장 년반 탈일본 넘어 세계로올해  조 투입
2021-01-24,빨라진 속도풍성해진 캠 기능 가성비 좋아져 오감 만족
2021-01-24,자이앤트레터 터키 와 맞먹는 시장리틀 버핏이 주목하는 이 기업
2021-01-24,기업 옥죄기일 뿐이익공유제 금융 울고 산업계는 불안
2021-01-24,배신자 욕먹는 연기금 전문가 독립적 판단에 맡겨야
2021-01-24,  완화기조 재확인할까 대형주테슬라 분기 실적도 주목 주간 증시 전망
2021-01-24,천재수학자의 최애종목투자 어떻게 할겁니까
2021-01-24,소부장 독립 외쳤지만 작년 일본 의존도 더 높아졌다
2021-01-24,실형 받으면 법정구속 법원 규칙 더 엄격하게 바뀌었다
2021-01-24,년 설정 후 수익률  국내 최장수 배당주 펀드 이런 펀드 어때요
2021-01-24,주간증시전망 는 변수테슬라애플 등 실적 주목
2021-01-24,폰을 펼쳤더니 쩌억 소리가 ㅠㅠ 폴더블폰 동파 주의 선빵
2021-01-24,주간증시전망바이든 시대 첫  결국은 실적
2021-01-24,역대 가장 많이 오른 주식은 배 새롬기술
2021-01-24,우릴 몽둥이질 했지만 원망 말아야  화웨이 회장 메시지 왜 이제 공개
2021-01-24, 수출규제 년 반자신감 붙은 산업부 변화 바람 분다
2021-01-24,우병우 어떤 운명 국정농단 방조불법사찰 심 선고
2021-01-24,화웨이 런정페이 회장 미국이 우리에 바라는 건 죽음 뿐
2021-01-24,박현주 회장의  조언분산투자하고 곱버스 투기 경계하라
2021-01-24,이익공유제 원조 정운찬마저상생법은 억지정책
2021-01-24,아웃백 슬그머니 가격 인상수익성 극대화로 몸값 높이기
2021-01-24,한국에서 보다 배 빠른 ㎓  쓰려면아직 멀었다
2021-01-24,그래픽 주요 그룹 총수 수감 기간 그룹 주력사 주가 및 코스피 상승률
2021-01-24,주목스몰캡실적 반등의 해차전지 검사장비 기업 브이원텍
2021-01-24,대기업 들어오고 교통 길 뚫리고호재 날개 단 평택 주택시장
2021-01-24,생체신호 살펴 큰병 예방하는 헬스케어 플랫폼 만들었죠 이사람
2021-01-24,덜 오른 중소형주 탐색해볼까흥국 머티리얼즈씨에스윈드한솔케미칼 주목
2021-01-25,이재용 재상고 포기투자는 어찌하나 고민 커진 삼성
2021-01-25,이재용 재상고 포기부회장의 취업제한 숙제 남은 삼성
2021-01-25,반도체 수급난미래 대엔 반도체 개 삼성반도체 더 중요해져
2021-01-25,삼성 분기에   탑재 엑시노스 나오나
2021-01-25,삼성전자 이재용 부회장 징역 년개월 확정양측 재상고 안 해
2021-01-25,이재용 재상고 포기대규모 투자 결정 앞두고 수장 잃은 삼성 앞날은종합
2021-01-25,손학규 이재용 삼성 부회장을 사면하라
2021-01-25,단독나노  반도체도 삼성테슬라 맞손
2021-01-25,실익없다 판단 개월 총수 공백 삼성 준법위 강화할 듯 삼성 리더십 위기 장기화되나
2021-01-25,삼성전자 다시 만전자 눈앞 상승 마감
2021-01-25,삼성은 잠재적 경쟁자 파운드리 늘리는 인텔의 속셈
2021-01-25,베일 벗은 삼성 미니  가격
2021-01-25,삼성 미니   프리미엄 쩐의 전략 나왔다
2021-01-25,삼성전자 총수부재 속 파운드리 투자 늘릴까
2021-01-25, 삼성 미국 반도체 공장 건설억 달러 투자
2021-01-25,갤럭시 달 사진 조작됐다삼성 인위적 합성 아냐
2021-01-25,특징주 삼성전자테슬라 맞손 반도체 
2021-01-25,이재용 판결 겸허히 수용 재상고 포기삼성 준법경영 고삐
2021-01-25,이재용 재상고 포기개월간 선장 잃는 삼성호
2021-01-25,삼성전자  올라 다시 만전자 코앞외인기관 쌍끌이종합
2021-01-25,삼성 년 개월간 총수 부재
2021-01-25,주문 쏟아지는 반도체삼성 진검승부
2021-01-25,반도체 없어 자동차 공장 삼성  증설 현실화되나
2021-01-25,오스틴공장 인근부지 용도변경 확인반도체  투자 고민 깊어지는 삼성
2021-01-25,삼성 이재용 수감 스캔들 딛고 더 강해질 것
2021-01-25,총수 부재 삼성비상경영 돌입 준법위 역할 해달라
2021-01-25,특징주 삼성전자 미 반도체 투자설에 장비 관련주 등 급등
2021-01-25,삼성전자  확정실적 발표 임박반도체가전 성과 주목
2021-01-25,삼성현대차 로봇 시장 격돌한다
2021-01-25,코스피 시총 상위 개 기업 점유율은 삼성전자  하이닉스가 양극화 뚜렷
2021-01-25,특징주 대장주 삼성전자 테슬라와 손잡는다 만원 재탈환 시도
2021-01-25,재상고 포기한 이재용 경영위기 길어진 삼성
2021-01-25,삼성전자 이재용 옥중회견문 가짜뉴스
2021-01-25,대장주 삼성전자 다시 만전자 임박장중  급등
2021-01-25,삼성디스플레이 폴더블 디스플레이 첫 외판하반기  스마트폰 업체 공급
2021-01-25,스마트공장시대 활짝상멘토 삼성 등 대기업도 통큰 지원
2021-01-25,주식 초고수는 지금 지금이 저가 매수 기회현대모비스삼성에 매수세 몰려
2021-01-25,  기아차  삼성전자 코스피 거품 경고 비웃듯 날아간다
2021-01-25,백브리핑 언론의 잇단 삼성전자 투자 보도 빨리 결단하라는 압박
2021-01-25,갤럭시폴드도 삼성디스플레이 코닝 수율 기대 이하
2021-01-25,삼성  폰 점유율 로 위
2021-01-25,특징주 엑셈 삼성전자 오스틴공장  증설에  공급사로 부각
2021-01-25,메리츠증권 삼성전자 분기 인텔 칩셋 양산 시작 가능성
2021-01-25,가구같은 에어컨 삼성 비스포크 무풍클래식 월 출시
2021-01-25,삼성전자 비스포크 무풍에어컨 공개
2021-01-25,어닝시즌 본격 개막코로나에 날개 단 전자부품업계
2021-01-25,개월간 선장 잃는 삼성호
2021-01-25,삼성전자 분기 내 인텔 칩셋 양산 개시메리츠
2021-01-25,코로나 위기 극복한 전자업계 올해 추가 성장 기대감 업
2021-01-25,이재용 재상고 포기 개월간 선장 잃는 삼성호
2021-01-25,특징주반도체 삼성테슬라 맞손 나노  반도체 개발에 강세
2021-01-25,애플삼성한 술 더 뜬 샤오미충전기 다 뺀다 선빵
2021-01-25,삼성한화만 지난해 이익 성장대그룹 실적 양극화
2021-01-25,특징주싸이맥스 삼성전자 반도체 투자 조원 소식에 강세
2021-01-25,삼성 이재용 재상고 딜레마하자니 실익 없고 안 하자니 실형
2021-01-25,의 시대 코스피  막오른 어닝시즌대그룹 중 삼성한화만 지난해 이익 성장 전망
2021-01-25,이재용 재상고 안 한다판결 겸허히 수용
2021-01-25,이재용특검 재상고 없다징역 년월 사실상 확정
2021-01-25,이재용 징역 년개월 재상고 포기특검은 고민중종합
2021-01-25,코스피 종가 기준 첫 선 돌파
2021-01-25,특검도 재상고 포기이재용 징역 년개월 확정
2021-01-25,이재용 고심 끝 판결 수용실익 없다 판단한 듯
2021-01-25,코스피 종가기준 첫 선 돌파기관외인 매수종합
2021-01-25,갤럭시 올해 국내 만대 판매 예상보다  증가
2021-01-25,마감시황코스피 사상 최고코스닥  목전
2021-01-25,이재용 국정농단 재상고 포기특검 결정에 따라 달라질 듯
2021-01-25,박영수 특검 재상고 않기로이재용 년 월 실형 확정
2021-01-25,이재용특검 재상고 포기 징역 년 개월 확정
2021-01-25,코스피 종가기준 첫 선 돌파기관외인 매수종합보
2021-01-25,갤럭시 국내 만대 판매보다  증가 예상
2021-01-25,연말정산시즌 개 간편인증서 진검승부
2021-01-25,이재용특검 재상고 포기징역 년 개월 확정종합보
2021-01-25,이재용 재상고 안한다 징역 년개월 사실상 확정
2021-01-25,손학규 이재용 부회장을 사면하라대통령 고민 많을 것
2021-01-25,갤럭시 올해 국내서 만대 팔린다
2021-01-25,이재용 재상고 여부 오늘 결정포기에 무게
2021-01-25,이재용 재상고 포기로 형량 확정년 개월 더 복역종합
2021-01-25,공학한림원 신년하례식 개최
2021-01-25,이재용 부회장 재상고 않기로 판결 겸허히 수용
2021-01-25,징역 년월 이재용 국정농단 사건 재상고 없다
2021-01-25,미국 유학하고 돌아와 논문만 쓰는 연구는 이제 그만
2021-01-25,반도체 생산 좀 늘려줘전세계가 대만에 
2021-01-25,갤럭시 만원이면 산다방통위 투명화 조치도 무용지물
2021-01-25,바이든 랠리에 코스피 종가 기준 첫  돌파
2021-01-25,테크트렌드상상 속 미래 가정용 로봇이 온다
2021-01-25,코스피 도 뚫었다버블 후 천스닥 눈 앞
2021-01-25,손학규 문대통령 이재용 사면해야재벌 문제 잘 알지만 경제 현실 심각
2021-01-25,외국인기관 쌍끌이천스닥 보인다
2021-01-25,코스닥 마감외국인기관 끌어올리니천스닥 바짝
2021-01-25,김정호  교수 디지털 공학 미래 담은 신간 출간
2021-01-25,손학규 문대통령 이재용 사면해야경제현실 심각
2021-01-25,실적랠리 서막증시 더 달군다 실적랠리 개막
2021-01-25,속보 이재용 재상고 포기 판결 겸허히 수용하겠다
2021-01-25,주식 펀드매니저 명 나는 올 상반기 전기차 사고 언택트 판다
2021-01-25,곽인찬의 특급논설 코로나 보상 증세가 정공법
2021-01-25,달라진 주린이들민스키 모델 엘리엇 파동은 기본
2021-01-25,손학규 문 대통령 이재용 사면해야 결단 요구
2021-01-25,이재용 측 판결 받아들인다재상고 포기 결정종합
2021-01-25,이재용 판결 겸허히 수용재상고 안해년 개월 더 복역
2021-01-25,갤 연간 만대 판매 예상갤보다  늘어날 듯
2021-01-25,돌아온 노트북 시즌분기 신제품 경쟁 후끈
2021-01-25,코스피 마감선 돌파외인기관 덕에 종가 최고치
2021-01-25,이재용 오늘 재상고 마지막 기회판결 뒤집기 어려워
2021-01-25,마켓뷰 외인기관 땡큐 코스피 종가 첫  돌파
2021-01-25,이재용 재상고 포기특검 오늘 재상고 여부 결정종합
2021-01-25,갤 국내 연간 판매량 만대전작 대비  증가 예상
2021-01-25,방 많아 스마트폰 필요 없다던  휴대폰 베트남 품으로
2021-01-25,테스 메모리 가격상승에 업황 반등 기대
2021-01-25,연합뉴스 이 시각 헤드라인  
2021-01-25,이재용도 기다리게 했다는데슈퍼을 은 누구 이지효의 플러스 
2021-01-25,경제정책의 정치화 심각착한 부채는 없어 재정중독 벗어나야 청론직설
2021-01-25,마감시황코스피 선 돌파코스닥도 천스닥 눈앞
2021-01-25,이재용측 판결 겸허히 수용재상고 하지 않기로
2021-01-25,이번주 증시 어닝시즌 돌입 대형주 줄줄이  주목
2021-01-25,시총 위권 대기업들 줄줄이 실적발표코로나 첫해 성적은
2021-01-25,갤럭시 시리즈 국내 만대 판매 전망 전작 
2021-01-25,열네살 주식수익 인증 만원제주 초등생의 투자비법
2021-01-25,갤럭시 국내 연간 판매량 전작 대비  늘어날 것
2021-01-25,이재용 재상고 포기년개월 징역형 확정
2021-01-25,갤럭시  국내 판매량  증가 예상폰 구조조정 반사수혜도
2021-01-25,실형법정구속 공식 년 만에 깨졌다
2021-01-25,올해 갤럭시  에 비해  판매 급증예상국내 만대 팔릴 것
2021-01-25,코스피 개인 사자에 대 상승
2021-01-25,이재용 부회장 재상고 포기 남은 형기 개월
2021-01-25,얼굴홍채 등 활용 인증 간편하고 빨라야 선택
2021-01-25,특징주테스 올해 최대 실적 기대감에 강세
2021-01-25,이재용측 재상고 안한다
2021-01-25,도 뚫었다 기관외국인 쌍끌이 매수
2021-01-25,기관 쌍끌이에 소외주도 상승 더 가면 천스닥코스피 코스닥 
2021-01-25,속보이재용 측 판결 겸허히 받아들여재상고 안해
2021-01-25,스마트폰 대중화에 금고 열쇠 된 지문 차량현관문도 
2021-01-25,이재용 측 판결 겸허히 수용재상고 포기 결정
2021-01-25,손학규  이재용 사면해달라잘못했지만 경제 현실 너무 심각종합
2021-01-25,코스피 기관 사자에 장중 선 회복
2021-01-25,갤럭시 울트라 반값 프로모션 및 아이폰  미니 가격 할인 기획전 눈길
2021-01-25,코스피 개인 사자에 상승 출발선
2021-01-25,재상고 포기한 이재용 재판부 판결 겸허히 수용특검도 재상고 않기로
2021-01-25, 수출규제품 불화수소 지난해 수입  줄었다
2021-01-25,이재용 재상고 포기 특검측은 오늘 오후 결론낼듯종합
2021-01-25,이재용 판결 겸허히 수용 재상고 않기로
2021-01-25,코스피  이끈 대형주 중소형주도 뒤따라갈까
2021-01-25,퇴근길 이용자가 원한다는데콧대높은 애플 맥북 디자인 바꿀까
2021-01-25,코스피 또 사상 최고점종가 선 넘어
2021-01-25,이재용특검 재상고 포기 배경은
2021-01-25,이재용특검 재상고 안한다 이재용 징역 년 월 확정
2021-01-25,코스피 개인기관 사자에 대 상승
2021-01-25,갤럭시 국내 연간 판매량  만대 전망전작 대비  증가
2021-01-25,갤럭시 판매량 만대 이를 것
2021-01-25,애플카 나온다는데이재용은 옥중경영
2021-01-25,보 코스피 종가 기준 첫 선 돌파
2021-01-25,속보이재용 국정농단 재상고 포기겸허히 받아들이겠다
2021-01-25,특검도 재상고 포기 이재용 징역 년개월 확정종합
2021-01-25,이재용 재상고 포기 남은 형기 개월
2021-01-25,이재용 이어 특검도 재상고 않기로징역 년 개월 곧 확정
2021-01-25,코스피 기관만 샀다하면 껑충실적 개선주 주목
2021-01-25, 데일리안 퇴근길뉴스 추미애의 뒤끝 윤석열 사퇴할 줄그 정도 눈치는 있어야
2021-01-25,이재용 재상고 포기 남은 형기는 개월
2021-01-25,코스피 종가  첫 돌파 코스닥도  고지 턱밑
2021-01-25,코스피  돌파코스닥  눈앞
2021-01-25,이재용 재상고 여부 오늘 결정포기 가능성에 무게
2021-01-25,재상고 않는 이재용 부회장가석방 요건 개월 더 복역해야
2021-01-25,실형 이재용 부회장 대법원 재상고 안 한다
2021-01-25,바이코리아에 코스피 첫   가 찬물 끼얹나
2021-01-25,산케이 이재용 부재 한국 경제에 미칠 파장 우려
2021-01-25,속보 이재용측 판결 겸허히 수용재상고 않기로
2021-01-25,특검도 이재용 파기환송심 재상고 않겠다
2021-01-25,당찬 제주 주린이 수익 대공개살이 년도 안돼 만원 육박
2021-01-25,미국증시 혼조 속 나스닥 사상 최고치애플 테슬라  호실적 예고 출근전 꼭 봐야하는 글로벌 모닝브리핑
2021-01-25,이재용 국정농단 재상고 안 한다판결 겸허히 수용
2021-01-25,전성인 칼럼이재용 박영선 그리고 박범계
2021-01-25, 월 마킷 제조업  역대 최고치 글로벌 이슈
2021-01-25,코스피 종가 기준 사상 첫 선 돌파 마감
2021-01-25,이재용 부회장 재상고 포기재판 최종 마무리될 듯
2021-01-25,고통 호소한 화웨이 원망 말아야미국에 화해 제스처 이지효의 플러스 
2021-01-25,이재용 부회장 국정농단 재상고 안 한다판결 겸허히 수용
2021-01-25,쇠락 폰 후폭풍도마위 오른 단통법
2021-01-25,리딩금융인  프론트엔드 개발자들이 들려주는 핀다 앱 개발기
2021-01-25,네이버카카오 라이브커머스 총력전누적 시청 억  만
2021-01-25,이재용 부회장 재상고 포기판결 겸허히 수용
2021-01-25,이재용 국정농단 실형 확정이재용측특검 모두 재상고 포기
2021-01-25,빨지 말고 삶으세요 적은 빨래용 살균 세탁기
2021-01-25,세균 잡고 멋은 살리고 우리집 공기가 달라졌어요
2021-01-25,갤럭시 무난한 스타트  전작보다  많이 팔렸다
2021-01-25,코스피 선 돌파코스닥 천스닥 눈앞종합
2021-01-25,현대차한화 광고도  바람 제품과 안 어울려 어색 반응도
2021-01-25,달리는 코스피에못 말리는 세대 주식 열풍
2021-01-25,게시판 한국공학한림원 신년하례식 개최
2021-01-25,천억 벤처 서비스 분야가 가장 빨리 도달
2021-01-25,이재용 측도 특검도 재상고 안 한다
2021-01-25,스마트공장시대 활짝상코로나 백신 주사기 생산량 배 껑충
2021-01-25,특검 재상고 않겠다이재용 년 개월형 확정
2021-01-25,특검도 재상고 포기이재용 징역 년 개월 확정
2021-01-25,탑 브랜드의 귀환천안아산 년 만에 더샵 아파트 나온다
2021-01-25,갤버즈 프로 주문 폭주로 배송 지연애니콜 감성 통했다
2021-01-25,이재용과 노회찬 공통점과 차이점
2021-01-25,시황종합코스피 대 오르며 선 뚫었다외국인기관 쌍끌이
2021-01-25,뉴스룸에서 팬택  그다음은
2021-01-25,전문특검 이재용 국정농단 사건 재상고 포기 입장문
2021-01-25,특검도 이재용 사건 재상고 안 한다징역 년개월 확정
2021-01-25,이재용측 판결 겸허히 수용재상고 하지 않기로
2021-01-25,이재용특검 재상고 않기로징역 년 개월 곧 확정종합
2021-01-25,스마트공장시대 활짝상생산성 향상 위해 데이터 관리 등 지원해야
2021-01-25,국정농단 이재용특검 재상고 포기  실형 확정 의미는
2021-01-25,반도체 수급난제의 와이어링 하니스 사태 막아라긴급 대책 논의
2021-01-25,코스피 종가기준 첫 선천스닥도 눈앞
2021-01-25,년 무풍에어컨
2021-01-25,실적 장세개미 코스피중소형주 월 효과 실종
2021-01-25,특검도 이재용 뇌물공여 사건 재상고 않기로국정농단 관련 모든 재판 종결
2021-01-25,일 만에 코스피 종가 선 돌파 최고가 경신
2021-01-25,이재용 징역 년개월 확정특검 국정농단 규명 재상고 안해종합
2021-01-25,단독  실형법정구속  필요하면 법정구속
2021-01-25,주말에만 왔다 가는 신데렐라 쇼핑몰 혹시 당신도 낚였나요
2021-01-25, 안착 코스피  목전 코스닥
2021-01-25,실적장세급증한 개미코스닥 월 효과 실종 포트라이트
2021-01-25,기관 사자 코스피  올라 선 넘어코스닥 선 눈앞
2021-01-25,경쟁 앱마켓 쓰지마라 게임사에 갑질공정위 구글 제재 착수
2021-01-25,이재용 국정농단 재상고 않는다형 확정될듯
2021-01-25,이재용 재상고 안한다판결 겸허히 수용
2021-01-25,갤럭시 스타트 순조롭다 첫날 개통량 
2021-01-25,이재용 재상고 포기실익없다고 판단한 듯
2021-01-25,고개 드는 도쿄올림픽 취소론 특수도 물 건너가나
2021-01-25,기업이 뛴다 하이닉스 박정호이석희 투톱 체제로 새로운 도약 꿈꾼다
2021-01-25,거침없는 대형주중소형주는 언제쯤
2021-01-25,도 넘은 공매도 포퓰리즘 기자시
2021-01-25, 세탁기태양광 몽니에도  기업 훨훨 날았다
2021-01-25,파죽지세 코스피 선 뚫고 하이킥 천스닥도 눈 앞으로
2021-01-25,코스피 장 중  돌파대 상승
2021-01-25,이재용 상고기한 오늘까지두번째 대법원 판단 받을까
2021-01-25,속보 코스피 장중 선 터치기관외인 쌍끌이 매수
2021-01-25,년개월 실형 이재용 대법원 재상고 안 한다보
2021-01-25,코스피 종가 기준 사상 첫 선 돌파 마감
2021-01-25,코스피 종가 선 사상 최고치실적 변수 남았다
2021-01-25,이재용 재상고 않기로판결 겸허히 받아들인다
2021-01-25,특검도 이재용 대법 재상고 않기로징역 년개월 확정보
2021-01-25,이재용 추석쯤 가석방 가능할까형량 분의 채우면 심사 대상될 듯
2021-01-25,기관 쌍끌이에 소외주도 상승 더 가면 천스닥
2021-01-25, 주간브리핑 초읽기 들어간 마이데이터 사업자 선정 금융위 일 발표
2021-01-25,오전시황개인 억 원 매수세코스피 선 탈환
2021-01-25,이재용특검 재상고 포기징역 년 월 확정
2021-01-25,연합뉴스 이 시각 헤드라인  
2021-01-25,코스피  다시 노릴까분기 실적에 주목하라
2021-01-25,마감시황코스피 선도 뚫었다시총  돌파
2021-01-25,코스피 또 일 냈다코스닥도 천 목전
2021-01-25,이재용 재상고 포기할 듯가석방 노릴까
2021-01-25,이슈분석이익공유제 부정댓글 공산주의긍정댓글 기업 키워드 가장 많아
2021-01-25,실형 땐 법정구속 필요하면 법정구속대법원 예규 개정
2021-01-25,코스피 기관 매수세에 선 터치코스닥도 선 눈앞
2021-01-25,브루킹스 정부 대북정책 인권 무시민주주의 훼손
2021-01-25,인사말 하는 김기남 부회장
2021-01-25,살 주린이 수익이 천만원초고수 수업 듣자 발길 이지효의 플러스 
2021-01-25,기자수첩  먹거리는 에서
2021-01-25,한국공학한림원 신년하례식
2021-01-25,속보특검도 재상고 포기 이재용 징역 년개월 확정
2021-01-25,한국공학한림원 신년하례식
2021-01-25,연합뉴스 이 시각 헤드라인  
2021-01-25,코스피는 사상 첫 선 돌파 코스닥은 선 코 앞
2021-01-25,속보 특검 이재용 국정농단 재상고 포기  징역 년개월 확정
2021-01-25,년 한국공학한림원 신년하례
2021-01-25,일템공공 와이파이 덕분에 태블릿 이통사 회선 의존도 급감
2021-01-25,기자수첩 양날의 검 과열되는 시장 그리고 인플레이션
2021-01-25,여의도동탄대전에 새 랜드마크 백화점 생긴다
2021-01-25,오전시황코스피 개인 사자에 상승세 확대
2021-01-25,인터뷰 주식농부 박영옥 스마트인컴 대표 코스피 은 출발점 코리아 프리미엄으로 갈 것
2021-01-25,이재용 이어 특검도 재상고 포기 징역 년개월 확정
