Date,title
2020-11-01,이건희 별세 이후 첫 창립기념일 맞은 삼성전자 이재용 시대 전환 공식화
2020-11-01,삼성전자 첫 상업용 비스포크 에어컨 일 출시
2020-11-01,두 번째 치러진 온라인 삼성 고시상반기보다 원활
2020-11-01,삼성 오늘 창립 주년이재용 뉴삼성 속도낸다
2020-11-01,증권가 삼성전자 목표주가 만만원
2020-11-01,화웨이 스마트폰 점유율 위로 주저앉아삼성 위 탈환
2020-11-01,상속세 의 경제학삼성 지배구조주가 영향은 성시경 쇼
2020-11-01,코로나 집콕이 만든 삼성 가전 대박 분기에도 이어지나
2020-11-01,춤추는 삼성그룹주 어떤 주를 사야할까
2020-11-01,호실적 달성한 삼성전자 분기 전망은
2020-11-01,삼성 오늘 창립기념일이건희 별세 일주일만
2020-11-01,창립 주년 맞은 삼성전자
2020-11-01,삼성은 어떻게 램 최강자가 됐을까 임주형의 테크토크
2020-11-01,조기 걸린 삼성 사옥
2020-11-01,강병준의 어퍼컷삼성 이재용 시대의 번 과제
2020-11-01,번가  십일절 개막삼성다이슨몽클레르 총출동
2020-11-01,삼성 러시아서 년 연속 가장 사랑받는 브랜드 위
2020-11-01,역대급 실적 전자업계내년 불확실성 뚫을 돌파구는
2020-11-01,삼성 비스포크 상업용 에어컨 오늘 출시
2020-11-01,지난달 수출  감소반도체는 개월 연속
2020-11-01,경총  룰 기업 압박외국계 투기자본에 힘 쏠릴 것
2020-11-01,퓰너 이건희 회장 뛰어난 기업가이자 통찰력 있는 리더 추도 메시지
2020-11-01,최서원 집사 한국 송환 초읽기판도라 상자 열리나
2020-11-01,인간 이건희 끝  아성 넘은 디자인 경영
2020-11-01,트럼프  바이든대선 결과 따른 수혜주는
2020-11-01,이슈분석커머스 월 쇼핑대전역대급 물량전 펼친다
2020-11-01,이미지센서 있으면 뭐하나화웨이 반도체 자립 시도
2020-11-01,평균값에서 가장 먼 류호정이 원피스작업복을 입는 이유
2020-11-01,코스피 지난달 개월만에 월단위 첫 하락 개미는 상승에 베팅
2020-11-01,폰안의 비서 그들만의 전쟁을 시작했다
2020-11-01,재계 톡톡풍수지리로 본  이건희 묏자리자좌오향의 명당
2020-11-01,외국인 주만에 팔자배터리는 담아
2020-11-01,진화하는 손목 위 주치의 스마트워치 시장 쟁탈전
2020-11-01,인간 이건희  천재 명이 만명 먹여 살려경제 주역
2020-11-01,내 슬픔은 누구에게 등을 보이고 누구의 얼굴을 바라보나
2020-11-01,우리 집 거실이 조용해진다저소음 가전 증가
2020-11-01,코스피 지수보다 못한  액티브 
2020-11-01,취향 맞춤 인테리어 가전 상업용도 이젠 형형색색
2020-11-01,월 화웨이 쇼크 없었다 비보애플소니에 웃는 반도체 수출
2020-11-01,수소차 뜬다는데어디 투자해야 할까
2020-11-01,주간 블록체인 빅 플레이어 움직임 본격화되는 블록체인가상자산업계
2020-11-01,인터뷰기계가 쏟아내는 데이터 진정한 가치 찾아주죠
2020-11-01,인간 이건희  임원 사장까지 돼야여성 인재 중용
2020-11-01,대작 개봉도 못하고  직행 영화산업 울상이러다 영화관 사라질까
2020-11-01, 배 광속의 진실 ㎓  무조건 좋다
2020-11-01,소부장 유망기업탐방 제우스  독점 반도체 세정장비 국산화
2020-11-01,  폐막 소부장 미래 봤다
2020-11-01,인간 이건희  나눔경영 뚜렷한 발자국사회공헌도 일류
2020-11-01,조정훈의 빨간 여권과 류호정의 분홍 원피스
2020-11-01,전화성의 기술창업   스타트업 창업자가 배워야 할  이건희 회장의 기업가 정신
2020-11-01, 빅스마일데이 동참전 상품 무료배송
2020-11-01,경북  생활복지 사업 정부 공모 선정개 시군에 적용
2020-11-01,인간 이건희  애틋한 강아지 사랑반려견 인지도 제고
2020-11-01,한국소설 새 바람 일으킨 작가 인방
2020-11-01,르포국내 최대 솔라시도 태양광발전단지 가보니계통체계안전대책 완비
2020-11-01,삼성전자 비스포크 상업용 스탠드 에어컨 출시
2020-11-01,이건희 떠난 삼성전자 오늘 창립기념일
2020-11-01,창립기념일에 조기 걸린 삼성 사옥
2020-11-01,창립 주년 본격적인 이재용 시대 맞이한 삼성전자
2020-11-01,이건희 회장 별세 후 첫 창립기념일 맞는 삼성전자
2020-11-01,창립 주년 본격적인 이재용 시대 맞이한 삼성전자
2020-11-01,이재용 뉴삼성 가속페달임원인사 고심
2020-11-01,미래 먹거리 창출대규모 투자 표 뉴삼성 속도 낸다
2020-11-01,조 빅딜 일만에 이끈 결단 실용주의 경영 속도낸다 뉴 삼성 이재용 시대
2020-11-01,삼성고시  상반기 보다 수월난이도 평이했다
2020-11-01,삼성 스마트폰 위 탈환화웨이애플 샤오미는
2020-11-01,재판 대응에 해외출장까지 쉴틈없는 일정 내달초 삼성 사장단 인사도 주목 뉴 삼성 이재용 시대
2020-11-01,삼성전자 비스포크 상업용 에어컨
2020-11-01,삼성전자 비스포크 상업용 에어컨 출시
2020-11-01,코스피 주간 외국인 순매도 위 삼성전자
2020-11-01,코스피 주간 개인 순매수 위 삼성전자
2020-11-01,코스피 주간 기관 순매도 위 삼성전자
2020-11-01,포토 삼성전자 상업용 비스포크 에어컨 출시
2020-11-01,단독 저커버그  리더십 감명이재용 부회장에 위로 메일
2020-11-01,   불량률 제로 도전세계 최고  기술 갖춘 쎄크
2020-11-01,한국 안가 최서원 집사 소송 기각한 네덜란드 대법원
2020-11-01,저커버그 하버드 동문 이재용 부회장에 애도 메일
2020-11-01,경총 상법 개정안 소액주주 아닌 외국계 펀드 입김 강화  의결권까지 크게 제한
2020-11-01,번가  십일절 페스티벌 진행
2020-11-01,저커버그 이재용 부회장에게 부친상 애도 이메일 보내
2020-11-01,룰 적용땐 의결권  묶인다
2020-11-01,월 하락장에 상승 베팅한 개미들레버리지  가장 많이 사
2020-11-01,월 하락장 속 개미들 레버리지  투자 몰려
2020-11-01,번가 억원 대박 세일 십일절 페스티벌 시작
2020-11-01,아이폰 사전예약 돌풍  가입자 올해 만 넘긴다
2020-11-01,사나폰 아이폰 미니프로맥스도 사전예약 이벤트선착순 에어팟 프로 증정
2020-11-01,민관 힘 합친 월 내수 총력전코로나 블루 잡는다
2020-11-01,희토류 금속 없이도 높은 외부 양자효율 나타내는 고색순도 청색  재료 개발
2020-11-01,주목스몰캡속도내는 친환경 시대도약 꿈꾸는 해성디에스
2020-11-01,플러스 초과수익 한계 상관계수 벽 넘을까
2020-11-01,아다지오 원단 출시 일산가구단지 루헨퍼니처 제품 리뉴얼 기념 고급쇼파 전시품 할인
2020-11-02,삼성전자 창립 주년 기념식이건희  이어받자종합
2020-11-02,삼성전자 주년 기념식이재용 불참하고 메시지도 없어
2020-11-02,삼성전자 제회 삼성  포럼  개최유튜브 생중계
2020-11-02,삼성전자 창립 주년 이건희  이어받자이재용은 불참
2020-11-02,이건희 회장 주식 상속되면 주식 부호 위 모두 삼성
2020-11-02,삼성 불법파견 봐주기 정현옥 전 노동부 차관 심도 무죄
2020-11-02,바이오 요람 샌프란시스코에 둥지 튼 삼성바이오로직스
2020-11-02, 이건희 회장 별세에 요동치는 삼성그룹주삼성전자물산 주가 더 오를 수밖에
2020-11-02,박병석 의장 삼성전자 한베트남 경협 상징세계적 표준 돼 달라
2020-11-02,단독 고마워 집콕 삼성 판매 신기록 보인다
2020-11-02,삼성전자 마의 벽 만원
2020-11-02,삼성전자 반도체 소부장 협력사 곳에 억여원 투자
2020-11-02,협력사 안전이 모두의 안전삼성전자 페이스메이커 운영
2020-11-02,삼성전자 케이씨텍 등 개 소부장 기업에 억 지분 투자소부장 생태계 강화 가속페달
2020-11-02,무노조 경영 완전한 폐기삼성전자 노사 일 단체교섭 돌입
2020-11-02,수익 안정화상업용시장 공략 강화하는 삼성
2020-11-02,반도체 초격차 승부수 나올까끝없는 혁신이 삼성 
2020-11-02,박의장 삼성전자 한베트남 경협 상징세계 표준 돼달라
2020-11-02, 기술 교류의 장삼성 포럼  온라인 개최
2020-11-02,삼성전자 창립 주년 기념식
2020-11-02,삼성전자 창립 주년 기념식
2020-11-02,삼성전자 창립 주년 기념식
2020-11-02,삼성전자 창립 주년 이건희 도전혁신  계승하자
2020-11-02,삼성  포럼 
2020-11-02,삼성 불법파견 은폐 정현옥 전 고용부차관 심도 무죄
2020-11-02,삼성 불법파견 은폐 의혹 정현옥 전 차관 심도 무죄
2020-11-02,앤시스 삼성 핀펫 공정용 다중 물리 솔루션 인증 획득
2020-11-02,삼성 이건희 없는 주년 창립일 혁신 정신 계승창조 기업 되자
2020-11-02,올해 두 번째 온라인 삼성고시 불싸트 아니지만 시간 부족
2020-11-02,이재용 부회장 삼성  진두지휘주도권 확보 속도
2020-11-02,김기남 부회장 가 삶에 도움 주는 방안 찾아야삼성  포럼 개최
2020-11-02,창립기념사 하는 김기남 삼성 대표이사 부회장
2020-11-02,삼성전자 퇴직임원인데 좋은 창업멘토가 될 수 있나요
2020-11-02,엘오티베큠 삼성전자에 억 유상증자 결정
2020-11-02,창립 돌 년 삼성 미래 향해 함께 걸어가자
2020-11-02,삼성 소부장 국산화에 올 억 쏜다
2020-11-02,년간 주식보유 위 이건희 회장 사후 순위 변동은삼성 위
2020-11-02,박병석 삼성전자 한베트남 경협 상징적 기업이건희 세계의 삼성 만들어
2020-11-02,저력 보여준 삼성분기에도 웃을까
2020-11-02,창립 주년 삼성전자 이건희 도전열정 이어 년 기업 기반 구축
2020-11-02,삼성 소부장 불꽃투자 칩 소재도 초격차
2020-11-02,삼성전자 창립 주년 기념식 진행엄숙하고 조촐히 진행
2020-11-02,삼성 나노  공급 본격화서 엑시노스 공개
2020-11-02,삼성전자 창립 주년 기념식
2020-11-02,삼성전자 창립 주년 기념식
2020-11-02,이재용의 뉴삼성이 집중하게 될 가지 신사업
2020-11-02,삼성 창립 주년
2020-11-02,삼성전자 창립 주년이건희 회장 도전열정 이어받자
2020-11-02,삼성전자 창립 주년 기념식 개최
2020-11-02,삼성 창립 주년
2020-11-02,삼성전자 창립 주년 기념식 개최
2020-11-02,삼성전자 첫 나노  엑시노스  전격 공개
2020-11-02,창립 주년 맞이한 삼성
2020-11-02,조 삼성 곳간 열쇠 당신에게 맡긴다면오동희의 
2020-11-02,삼성전자  포럼 개최김기남 팬데믹 등 해결 위해  기술 발전 중요
2020-11-02,창립 주년 맞이한 삼성
2020-11-02,오늘의 전자 단신 매직 올클린 공기청정기 출시 
2020-11-02,삼성전자 오는 일 나노 차세대 칩셋 엑시노스  중국서 첫 공개
2020-11-02,삼성전자서비스 불법파견 은폐 혐의정현옥 전 노동부 차관 심서도 무죄
2020-11-02,삼성 창립 주년 기념식 날 소부장 기업에 억 투자
2020-11-02,엘오티베큠 진공펌프 고도화 기술 선점삼성전자 대규모 유증 투자
2020-11-02,삼성 주년 창립기념식 오늘 개최
2020-11-02,분기 실적 시즌 막바지삼성전자 빼면 평범
2020-11-02,김기남 삼성전자 부회장  기술 팬데믹자연재해의 현실 세계 문제 해결해야
2020-11-02,삼성 불법파견 은폐 정현옥 전 고용부차관 심도 무죄
2020-11-02,박의장 한베트남 경협 상징 삼성전자 절대적 기업 됐다
2020-11-02,창립기념사 하는 김기남 삼성 대표이사 부회장
2020-11-02,삼성  포럼  개회사 하는 김기남 대표이사
2020-11-02,엘오티베큠 삼성전자에 억 규모 유상증자 결정
2020-11-02,삼성  반도체 생태계 강화소부장 협력사 억원 투자
2020-11-02,특징주 상속세 이슈 탓 삼성전자 거래일째 하락세
2020-11-02,삼성전자 창립 주년 기념식 개최
2020-11-02,삼성전자 주년 기념식
2020-11-02,삼성 불법파견 은폐 정현옥 심도 직권남용 아냐
2020-11-02,등사업 집중 내달 사장단 인사사업재편 밑그림 재구상 뉴 삼성 이재용 시대
2020-11-02,제회 삼성  포럼  개회
2020-11-02,제회 삼성  포럼 
2020-11-02,이재용 총수 시대 본격 개막삼성 새 반세기 첫 발 디뎠다
2020-11-02,갤럭시 삼성 첫 공짜 폰 등극출고가 또 인하
2020-11-02,엘오티베큠 삼성전자 대상 억원 유상증자 결정
2020-11-02,년 삼성 미래를 향해 함께 걸어갑시다
2020-11-02,삼성  포럼  개회사 하는 김기남 대표이사
2020-11-02, 기술 교류의 장삼성 포럼  온라인 개최
2020-11-02,특징주 삼성전자가 억원 투자 뉴파워프라즈마 소폭 상승
2020-11-02,이재용의 뉴삼성기회 새로운 도전 변화혁신으로 미래 이끈다
2020-11-02,삼성전자 창립 주년 기념식 이건희 회장님 도전과 열정 이어받자
2020-11-02,삼성 비스포크 상업용 에어컨 첫 출시
2020-11-02,삼성전자 뉴파워프라즈마에 억원 투자 결정
2020-11-02,삼성 포럼  온라인으로 개최
2020-11-02,이재용의 뉴삼성 대형  등 공격 경영 예고
2020-11-02,재수감된  날 구속해도 진실 못가둬
2020-11-02,초면 결함 검출 전자부품 불량률 제로 도전
2020-11-02,전자 무선 이어폰 톤 프리 출시에어팟갤버즈와 경쟁
2020-11-02,바뀌는 순위 주식부자 위 눈앞에 둔 이재용
2020-11-02,단독  프린팅 사업서 희망퇴직코로나로 사업 위축
2020-11-02,단독 갤로 친디아 공략세계위 굳히기
2020-11-02,이건희 별세 후 주식 부자 순위 변동이재용 위 확실시
2020-11-02,이건희 회장 도전혁신 계승 판 바꿔나가는 창조기업되자
2020-11-02,이건희 도전열정 이어받아 창조 기업으로 진화
2020-11-02,다시 감옥에 갇힌 이명박 날 구속할 순 있어도 진실 가둘 수 없어종합
2020-11-02,화웨이 수출규제에 맞서 반도체 공장 세운다
2020-11-02,단독 조  이끈 이석희 하이닉스  컨콜서 직접 소통 나선다
2020-11-02,팬데믹자연재해 속  기술 방향은
2020-11-02,애플워치 심전도 측정 한국서도 된다
2020-11-02,비트코인 지갑서비스 사업자도 자금세탁방지 의무 부과
2020-11-02,마크 저커버그 이재용 부회장에게 애도 메일기꺼이 돕겠다
2020-11-02,주식부호 순위 바뀐다 이재용 부회장 위 유력
2020-11-02,이건희 회장 열정 계승 년 기업 기반 구축
2020-11-02,제왕 이건희를 부러워한  명문대생들
2020-11-02,갤럭시는 번 접는다는데 애플은 언제쯤그래
2020-11-02,이건희 회장의 도전  계승 판도 바꾸는 기업으로 진화하자
2020-11-02,화웨이 미국에 맞서  상하이에 반도체 공장 설립 추진
2020-11-02,줄잇는 세기의 재판 월은 법원의 시간
2020-11-02,코스피 마감개인 순매도에도  넘게 올라선 재돌파
2020-11-02,롯데하이마트온라인쇼핑몰 오늘부터 역대급 빅 하트세일
2020-11-02,특권 내려놓은 조정훈류호정콘텐츠 집중 진짜 정치가 나타났다
2020-11-02,베트남 순방중인 박병석 국회의장 양국 경제협력 중요
2020-11-02,박병석 의장 방문에 베트남 응답검역 간소화  최우선 고려
2020-11-02,이슈분석 나노 새로운 장 열린다아이폰로 본 부품 시장 전망
2020-11-02,연합뉴스 이 시각 헤드라인  
2020-11-02,나훈아의 테스형 말고 증시에도 테스형 있다
2020-11-02,년간 주식 부호 위 이건희 회장 그 자리 누가 차지할까
2020-11-02,연합뉴스 이 시각 헤드라인  
2020-11-02,김기남 부회장 팬데믹 등 해결 위해  기술 발전시켜야
2020-11-02,반도체 설비투자 늘자소재장비 방긋
2020-11-02,저커버그 이재용에게 이건희 추모 메일도울 일 있다면
2020-11-02,태블릿 만년 기대주에서 대세로팬데믹 덕 분기 역대 최대 성장
2020-11-02,시황종합 코스피  상승 선 회복코스닥도 선 올라
2020-11-02,코스피 대 상승 선 회복코스피도 선
2020-11-02,한국 역할에 진정한 비전 가졌던 기업인
2020-11-02,대선   공세에 멈춘  반도체 굴기 트럼프 재선시  반사이익
2020-11-02,반도체 실적 견인차 메모리단기조정 오나
2020-11-02,마켓뷰  경기 지표 호조에 증시도 활짝기관이 쌍끌이 매수
2020-11-02,갤폴드 만원짜리 애스턴 마틴 슈퍼카 에디션 나온다 선빵
2020-11-02,코로나 재확산에 달라진 소비 옷 안 사고 식기세척기 샀다
2020-11-02,인터뷰  엔비디아 그래픽 칩 기술도 사용료 받고 서비스될 수 있어
2020-11-02,미리보는 이데일리 신문안갯속  대선오늘 운명의 날
2020-11-02,아산시 행복나눔 프로젝트
2020-11-02,류정민의 이슈노력형 천재였던 이건희 할 수 있다는 자신감 심어줬다
2020-11-02,소부장 시즌 포문 열자 관련주 꿈틀투자 포인트는
2020-11-02,국내 최초 빌보드 핫 위 선정된 의 모든 것 수십조 경제효과 방탄이코노미병역특례 재조명
2020-11-02,코스피 기관 나홀로 사자에 상승 출발
2020-11-02,도 이르면 이번주 화웨이 수출 허가 기대
2020-11-02, 가입자 만 돌파아이폰로 만 달성하나
2020-11-02,밀물썰물 한 번뿐인 인생
2020-11-02,주식 초고수는 지금오랜만에 가치주에 꽂힌 초고수신한지주 매수 집중
2020-11-02,미코세라믹스 억원 규모 유상증자 결정
2020-11-02, 주간브리핑  통신업계 분기 실적  선방
2020-11-02,만 고지 앞둔 아이폰가 왔다
2020-11-02,홈인테리어 열풍업체간 컬래버에 온라인유통 채널 강화해 소비자 접점
2020-11-02,마크 저커버그 이재용에 위로 메일 이건희 리더십 감명
2020-11-02,엘오티베큠 억원 규모 유상증자 결정
2020-11-02,순천향대 다문화 학생 초청 특화프로그램 호응
2020-11-02,올댓차이나 화웨이 반도체 생산라인 신설 가동 추진
2020-11-02,뉴파워프라즈마 억원 규모 유상증자 결정
2020-11-02,이원욱   가입 환영한다
2020-11-02,매경시평 상속세법 과연 이대로 좋은가
2020-11-02,코스피 거래일 만에 반등선 상승 출발
2020-11-02,트럼프든 바이든이든 자유무역주의 회귀 없다
2020-11-02,이건희 회장 사후 주식부호 순위 지각변동이재용 위 유력
2020-11-02,마감시황 코스피 외인기관 매수세에 선 회복
2020-11-02,징역 년 확정 이명박 석방 일 만에 동부구치소 재수감
2020-11-02,알뜰폰 업계 아이폰 알뜰폰프리미엄 자급제 시험대
2020-11-02,순천향대 다문화 행복나눔 프로젝트 운영
2020-11-02,진짜 스마트워치로 탈바꿈하는 애플워치심전도 앱 국내서도 지원한다
2020-11-02, 가입자 만 돌파연내 만 달성 청신호
2020-11-02,오늘장 미리보기 보유 또는 하락 시 저점매수 대응
2020-11-02,우리가 스타트 끊었는데 미국이 진짜  오해와 진실
2020-11-02,아프리카 모바일 가입자 년 억명 돌파 전망
2020-11-02,마감시황외인기관 매수세에 코스피 선 회복
2020-11-02,속터지는 망품질에  가입자 이제야 만연내 만 빨간불
2020-11-02,개미 여전히 상승에 베팅인버스 팔고 레버리지 산다
2020-11-02,오늘의 주요일정광주전남월일 월요일
2020-11-02,박병석 의장 오늘 베트남 국가주석 등 면담입국절차 개선 노력
2020-11-02, 아이폰 열풍 왜 얘는 좀 다른 것 같아
2020-11-02,만원만원 귀족폰 갤폴드 일까지 반값에 판다 선빵
2020-11-02,성큼 다가온 구글 인앱결제 생태계에 미치는 영향은 네이버카카오 등 자체 결제 시스템 정조준
2020-11-02,우리 농업의 미래 짊어질 인력 제대로 키워야죠
2020-11-02,경북도 언택트 생활복지서비스 개발 나선다
2020-11-02,증시 불확실성 걷히나코스피  대 강세 마감
2020-11-02,소부장 국산화로 뉴딜글로벌 시장 조준
2020-11-02,빅데이터일 오전 주식시장 심리 단계 좋음
2020-11-02,퇴근길 년 마이너리티 리포트가 현실로홀로렌즈 국내 상륙
2020-11-02,반도체 생태계 재편 잇따르는 글로벌 반도체 산업 지각변동
2020-11-02,오전시황코스피 반발매수 유입에 강세코스닥 선 돌파
2020-11-02,주목받는  경영 지속가능개발목표경영지수 신규 선정 기업
2020-11-02,마감 코스피 미 대선 앞두고 외인기관 순매수에 상승 선 회복
2020-11-02,비에이치 분기 영업익 억원전년비 
2020-11-02,상장 개사 분기 순익 조나 줄었다
2020-11-02,   가 게임 개발도 돕는다
2020-11-02,위축된 개미월 개인 순매수 올 들어 최저
2020-11-02,마감시황 코스피 선 탈환 강세 마감
2020-11-02,사설의  가입 신재생에너지 확산의 마중물 돼야
2020-11-02,디스플레이  화웨이 수출길 다시 열리나
2020-11-02,불확실성에 움츠러든 개미월 개인 순매수 올들어 최저
2020-11-02,우미건설 경기 화성에서 지식산업센터 동탄 우미 뉴브 분양
2020-11-02,경북사회복지공동모금회 제대 회장에 전우헌 전 경북도 경제부지사
2020-11-02,코스피 반발매수세 유입에 선 탈환
2020-11-02,홍길용의 화식열전  중전회대선경제 패러다임이 바뀐다
2020-11-02,코로나 때문에프린팅코리아 전체 대상 희망퇴직
2020-11-02,차산업혁명 핵심 인프라 위치정보 독자적 시스템 구축
2020-11-02,이데일리 셀트리온 천억원 규모 코로나 신속진단키트 미국 공급 
2020-11-02,마감시황코스피 선 코스닥 선 회복반발매수에 상승 마감
2020-11-02,코스피 대 상승 마감외인 기관 동반 억원대 사자
2020-11-02,개장 코스피 기관 순매수에 선 상승 미 대선 여전히 부담
2020-11-02,코스피 장 초반 기관 매수에 소폭 오르며 선 코스닥 강보합
2020-11-02,단독검찰 김영란법 위반 김도현 베트남대사 시한부 기소중지
2020-11-02,코스피 반발매수 유입에  상승 회복
2020-11-02,시장 초과수익 한계에  상관계수 낮추거나  공개시점 늦출수도
2020-11-02,브랜드스타즈선정위원회 해외에서 사랑받는 대표한류브랜드 발표
2020-11-02,오전시황 코스피 외인개인 매수에 우상향
2020-11-02,코스피 장초반 상승세외국인기관 동반 순매수
2020-11-02,코스피 기관 사자에 사흘만에 오름세선 회복
2020-11-02,유진로봇  스캐닝 라이다 센서 한국공학한림원 선정 년 산업기술성과 개 기술 선정 알려
2020-11-03,미스터  이상완 전 삼성전자 사장 별세
2020-11-03,삼성전자 노사 상견례새로운 노사관계 역사적 현장 돼야
2020-11-03,삼성전자 노사 첫 단체교섭 시작개 노조 참여
2020-11-03,대 기업 불황기에도 임원 명 확 늘려삼성전자 최다
2020-11-03,삼성전자 풍요로운 삶 위한 인간 중심 가 목표
2020-11-03,완벽한 팔방미인삼성 게이밍모니터 미국서 극찬
2020-11-03,삼성 비스포크 빅스마일데이 에디션 나온다
2020-11-03,삼성 갤럭시 출시공식 깨고 서두르는 이유는
2020-11-03,삼성전자측과 인사 나누는 김만재 위원장
2020-11-03,삼성전자 픽 또 나올까 유망 스타트업 발굴 장 열린다
2020-11-03,삼성 모니터 오디세이   극찬 완벽한 게이밍
2020-11-03,노동조합공동교섭단 마주한 삼성전자
2020-11-03,창립 돌 삼성전자 도전과 혁신의  계승
2020-11-03,이건희 별세로 재조명받는 삼성 안주인 홍라희
2020-11-03,홍남기 삼성 상속세 질문에 검토 여지 있는지 보겠다
2020-11-03,지배구조 변경 앞두고 관망 삼성그룹주 펀드 자금 이탈
2020-11-03,박수치는 삼성노사공동교섭단
2020-11-03,삼성전자 더 나은 세상 위해 인간 중심  연구 집중
2020-11-03,일본 제치고 세계 위로 미스터  이상완 전 삼성전자 사장 별세
2020-11-03,박수치는 삼성전자 교섭위원
2020-11-03,삼성전자 단체교섭 상견례
2020-11-03,문답삼성 상속세 조원 가혹한 세금 논란
2020-11-03,삼성 비스포크 마켓옥션 빅스마일데이 에디션 나온다
2020-11-03,마주 앉은 삼성전자 노사
2020-11-03,삼성전자 노사 상견례발전적 결과 도출 희망
2020-11-03,입장하는 삼성전자 사측 교섭위원들
2020-11-03,일차 접어든 삼성  포럼인간 중심  연구 강조
2020-11-03,삼성전자 첫 노사 단체교섭
2020-11-03,인간 중심삼성  리더 승현준의 한마디
2020-11-03,삼성전자 삶을 더 풍요롭고 편리하게인간 중심  연구
2020-11-03,삼성전자 노사 차 본교섭
2020-11-03,승현준 삼성리서치 소장 인간 중심 와 삼성전자 비전 일맥상통
2020-11-03,첫 단체교섭 하는 삼성전자 노사
2020-11-03,삼성  포럼 
2020-11-03,포토박수치는 삼성전자 사측
2020-11-03,삼성전자 몰려든 개미들이번에도 통할까
2020-11-03,삼성전자 노사 상견례공동교섭단 첫 단체교섭 시작
2020-11-03,인사말 하는 나기홍 삼성전자 경영지원실 인사팀장
2020-11-03,포토인사 나누는 삼성전자 노사
2020-11-03,인사말 하는 나기홍 삼성전자 경영지원실 인사팀장
2020-11-03,사진인사하는 삼성전자 노사
2020-11-03,포토 인사하는 삼성전자 노사
