Date,title
2020-12-03,수능 마친 수험생 갤럭시노트도 있는데왜 아이폰만 살까 선빵
2020-12-03,이젠 갤럭시폰 사용자도 차내 디스플레이로 맵 보세요
2020-12-03, 잃어버린 년 빠른 추격자  년 내 기술력도 추월한다
2020-12-03,오늘의 부고 종합
2020-12-03,또 감염원 불상 광주 누적 확진자 명으로 늘어
2020-12-03,포스코건설 더샵 프리미엘 주거형 오피스텔 일 청약
2020-12-03,그룹 오늘 임원 인사박정호  사장 하이닉스 부회장 승진종합
2020-12-03,오후 주식시장은솟구치는 증시코스피코스닥 신고가 잔치
2020-12-03,롯데하이마트 수험생 대상 기획전기기 등 최대  할인
2020-12-03,시황종합 코스피 일째 사상최고  눈앞코스닥도  돌파
2020-12-03,롯데하이마트 수험생 대상 기기 최대  할인 판매
2020-12-03,다이아티비 인플루언서샵테이너 라이브 커머스 고객사 만족도 높아
2020-12-03,코스피 개장초 보합권장중 역대 최고 돌파후 반락
2020-12-03,정의당 제안한 재난연대세 코로나 위기 극복 대안으로 떠오르나
2020-12-03,쿠첸 직원 데려다 쿠쿠 밥솥 판매도 시켰다
2020-12-03,수능 끝 수험표 들고 어디서 쇼핑할까
2020-12-03,포토 고 수험생 잡아라
2020-12-03,둥근 조약돌 닮았네갤럭시버즈 프로 렌더링 공개
2020-12-03, 박정호 부회장 승진 내년 또 다른 변화와 의미가 있는 한 해
2020-12-03,원화강세백신 기대동학개미외국인 코스피 랠리 배경
2020-12-03,월 일 궂긴 소식
2020-12-03,광주 확진자 명 추가안정세 속에 수능 이후 변수 경계
2020-12-03,부고 이만기 전 한양증권 사장 별세 외
2020-12-03, 홍익대 교수에 디자인 지휘봉 맡겨
2020-12-03,코스피 사흘 연속 사상 최고치 경신
2020-12-03,마감  보인다 코스피  또 신기록
2020-12-03,광주 안정세로 접어드나 주말까지 모임 금지
2020-12-03,오전시황코스피 장중 역대 최고 돌파후 반락환율은 선 깨져
2020-12-03,코스닥 개월 반만에 선 돌파
2020-12-03,뷰티브랜드인플루언서 라방 효과 톡톡매출  상승
2020-12-03,고덕국제신도시 대형 앵커테넌트 갖춘 알짜 상업시설 브리티시 고덕 분양
2020-12-03,일 연속 천장뚫은 코스피선 턱밑
2020-12-03,내년 월 공매도 재개불법공매도 징역개인대주활성화
2020-12-03,코스피 또다시 최고가 경신 선 돌파
2020-12-03,원화가치 년 반 만에 최고원대 진입
2020-12-03,코스피 장중 최고치 다시 경신까지 올라
2020-12-03,포스코건설 더샵 프리미엘 주거형 오피스텔  일 양일간 청약접수
2020-12-03,데스크라인산업데이터를 허하라
2020-12-03,공짜 달력 찾아 은행 떠도는 달력 낭인
2020-12-03,빅데이터일 오전 주식시장 심리 단계 약간 좋음
2020-12-03, 초읽기 들어간 코스피환율 하락백신 효과에 고공세
2020-12-03,코스피 장중 선 넘어  눈앞환율 원선 깨져
2020-12-03,오늘의 부고  년 월 일
2020-12-03,속보하이닉스 만원 신고가 경신
2020-12-03,스페셜 국민소통포럼  정은우 대학내일 연구소장    
2020-12-03,이사람 기술기업 에 유통 혁신 길 있다
2020-12-03,시그널 대기업부터 유니콘까지 러브콜위어드바이즈 년차 로펌 맞아
2020-12-03,굿모닝 증시코스피 탄력 둔화 우려  점증하는 펀더멘털 기대
2020-12-03,엔씨캠 반도체  낸드분야 핵심기업년새 생산량 배 매출 배로
2020-12-03,시황 코스피 선 유지 외국인 순매도로 돌아서
2020-12-03,질주하는 하이닉스시총  정조준
2020-12-03,코스피  가시권 환율 원대 진입 영향 받나
2020-12-03,연일 최고가 찍는 코스피 내년에도 상승랠리 가즈아
2020-12-03,조국발 대입 공정성 논란에 서울 소재 대학 정시 확대
2020-12-03,국내 첫 소화기에서 롯데타워 소방설계까지 대째 
2020-12-03,알뜰폰업계 고맙다 아이폰
2020-12-03,코스피 사흘 연속 최고치 경신코스피  시대 열릴까
2020-12-03,부고 송명훈 정치부 기자씨 부친상
2020-12-03,년 반 만에 원대로 내려온 환율 원 마감
2020-12-03,코스피  고용지표 부진과 대중국 갈등 우려 고조로 하락 전환
2020-12-03,개장코스피 장중 최고치  출발 게임엔터주 급상승
2020-12-03,데스크칼럼 항공산업 위원회 체제로산업은행에 달렸다
2020-12-03,  다이아 티비 인플루언서샵테이너 라이브 커머스로 고객사 만족도 제고
2020-12-03,펀드줌인 미래에셋아시아그로스펀드 아태 주식형펀드중 수익률 톱
2020-12-03,부음송명훈 정치부 기자씨 부친상
2020-12-03,선 눈앞에 둔 코스피외국인이 관건 순매수 약해질 수도
2020-12-03,수능 대목 잡아라플래그십 공시지원금 오르고 출고가 내려
2020-12-03,원달러 환율 원 위협코스피 장초반 혼조세
2020-12-03,부음 예종홍국민대 교수씨 장인상 
2020-12-03,미리보는 이데일리 신문환율 원도 아슬아슬수출 비명
2020-12-03,국내외 여명 온라인으로 강연토론 즐겨
2020-12-03,오전시황코스피 사흘째 오름세장중 고점 찍어
2020-12-03,부고송명훈 정치부 기자씨 부친상
2020-12-03,알림  글로벌 소재부품장비 테크페어
2020-12-03,이사람  딜로이트 정동섭이해섭 파트너 유통혁신 기술기업 에 길
2020-12-03,코스피 거침없는 질주 오르며 사흘째 최고치 경신
2020-12-03,팀장칼럼 대한민국의 미래 성장 엔진이 안 보인다
2020-12-03,국내증시 장 초반 강세코스닥 선 돌파
2020-12-03,매경이 전하는 세상의 지식매세지월일
2020-12-03,부고 송명훈 정치부 기자씨 부친상
2020-12-03,와우넷 무료방송 년 주도주를 찾아라
2020-12-03,포스트 코로나 시대 원스톱 라이프에 주목하는 부동산 시장 구리 갈매지구 힐스테이트 갈매역 스칸센 화제
2020-12-03,퀄컴서밋 밀리미터웨이브 글로벌  성패 가르나개 통신사 준비
2020-12-03,부음 송기홍씨 별세
2020-12-03,코로나 파고 디지털혁신으로 넘는다로봇이 물품 파악최적지 운반까지 척척스마트 물류 영토 확장
2020-12-03,코로나 파고 디지털혁신으로 넘는다페이클라우드 쇼핑 테크로 번거로운 결제는 쓱
2020-12-03,부고송명훈 정치부 기자씨 부친상
2020-12-04,삼성전자 부사장 명 등 총 명 역대급 임원 승진 인사
2020-12-04,삼성전자 코로나 극복 이끈 직원에 역대급 승진 보상종합
2020-12-03,부고 송명훈씨 정치부 기자 부친상
2020-12-04,삼성전자 임원 명 승진호실적에 년 만에 최대 승진
2020-12-04,만전자 시대 열렸다삼성전자 종가도 첫 만원대
2020-12-04,삼성전자 년 임원인사 승진자 명 명단
2020-12-04,삼성전자 예비  부사장 명 승진 인재도 대거 발탁종합
2020-12-04,삼성전자 명 부사장 승진 미래  후보군 확 늘렸다
2020-12-04,삼성전자 임원 명 승진역대급 별들의 잔치
2020-12-04,삼성전자 미래 명 부사장 발탁
2020-12-04,삼성 강석립 부사장 등  주역들 승진
2020-12-04,삼성전자 원   정식 업데이트 시작
2020-12-04,코스피 견인하는 반도체삼성전자하이닉스 역대 최고가
2020-12-04,삼성전자 원    정식 업데이트 시작
2020-12-04,비스포크 주역들 승진 잔치삼성전자 글로벌 가전 등 노린다
2020-12-04,이재용 역대급 명 발탁부사장 승진 명젊은 삼성 거듭난다
2020-12-04,대치 은마아파트  오를 때 삼성전자  뛰었다
2020-12-04,삼성 공장 있는 베트남에 기업인 신속통로 열린다
2020-12-04,삼성전자 임원인사외국인여성 승진 명 다양성포용성 강화
2020-12-04,삼성전자 소프트웨어 분야 첫 전무 탄생최연소 임원도 
2020-12-04,육군 내년부터 삼성 갤럭시으로 각개전투한다
2020-12-04,소프트웨어도 공유 시대 삼성 리서치 오픈소스 리더들
2020-12-04,삼성전자 임원인사  펠로우 명마스터 명 선임 최고 기술회사 지향
2020-12-04,삼성전자 오늘 정기 임원 인사세대교체 큰 폭 전망
2020-12-04,삼성전자 별 중의 별 대표이사급 월기본급만 최고 억 성과급은 수십억
2020-12-04,성과 앞에 선후배 없다삼성전자 발탁승진 역대급
2020-12-04,프로필 박성제 삼성전자 사업부 개발랩 상무
2020-12-04,프로필김학상 삼성전자 무선사업부 개발팀장 부사장
2020-12-04,이재승 사장 필두로삼성전자 생활가전 임원 줄줄이 승진
2020-12-04,이재용 운명 쥔 삼성 준법위전문심리위원 평가 앞두고 시간 회의
2020-12-04,삼성전자 임원인사소프트웨어 우수 인력 대폭 승진 미래 핵심 성장동력 확보
2020-12-04,프로필이준희 삼성전자 네트워크사업부 선행개발그룹장 부사장
2020-12-04,프로필 안정수 삼성전기 부사장
2020-12-04,프로필 이강협 삼성전자 생활가전사업부 전략마케팅팀장 부사장
2020-12-04,프로필최방섭 삼성전자 북미총괄  모바일비즈니스장 부사장
2020-12-04,프로필 이준희 삼성전자 네트워크사업부 선행개발그룹장 부사장
2020-12-04,프로필이석준 삼성전자 시스템사업부 개발실장 부사장
2020-12-04,삼성 프로필 이강협 삼성전자 생활가전사업부 부사장
2020-12-04,프로필 한상숙 삼성전자 사업부 서비스 비즈니스팀 부팀장 전무
2020-12-04,삼성 프로필 이종열 삼성전자 메모리사업부 부사장
2020-12-04,삼성 프로필 윤장현 삼성전자 무선사업부 부사장
2020-12-04,프로필 윤장현 삼성전자 무선사업부  플랫폼 팀장 부사장
2020-12-04,삼성 프로필 김학상 삼성전자 무선사업부 부사장
2020-12-04,삼성 프로필 이석준 삼성전자 시스템사업부 부사장
2020-12-04,프로필 최승범 삼성리서치 기술전략팀장 부사장
2020-12-04,코스피 날자 삼성전자도 만원 터치
2020-12-04,삼성전자 파운드리 인력 대거 승진
2020-12-04,삼성전자 원    정식 업데이트 시작
2020-12-04,삼성전자 원    정식 업데이트 시작
2020-12-04, 만원 돌파한 삼성전자 파운드리이미지센서 세계 위 가능
2020-12-04,삼성전자 년 만에 최다 명 임원 인사성과주의 반영
2020-12-04,삼성 강석립 부사장 등 명 임원 인사
2020-12-04,전력질주 삼성전자 주 신고가 경신대 상승
2020-12-04,프로필 김강태 삼성리서치 전무
2020-12-04,코스피 사상 첫 선 돌파삼성전자도 만원 훌쩍
2020-12-04,삼성전자 부사장 명 승진성과주의인재 강화종합
2020-12-04,만전자 시대 연 삼성전자하이닉스도 사상 최고가 경신
2020-12-04,성과 있는 곳에 보상 있다삼성 승진 키워드는
2020-12-04,삼성 갤 원  업뎃중요정보 돋보이게
2020-12-04,삼성전자 년 만에 최대 승진부사장 명 등 명 승진
2020-12-04,삼성전자 정기 임원인사 명 승진안정 속 쇄신 추구
2020-12-04,삼성전자 호실적에 년 만에 임원 최대 승진 인사
2020-12-04,삼성 갤럭시 확 키운 임원들 일제히 승진
2020-12-04,삼성전자 원   정식 업데이트 시작 갤럭시  싹 바뀐다
2020-12-04,만원 넘은 삼성전자 사흘째 사상 최고가 경신
2020-12-04,삼성전자하이닉스 랠리연일 장중 신고가 경신
2020-12-04,종합 삼성전자 명 승진자 배출호실적에 년 만에 최다
2020-12-04,프로필 유미영 삼성전자 생활가전사업부 개발그룹장 전무
2020-12-04,삼성전자 년 임원인사 승진자 명단
2020-12-04,삼성전자 부사장 명 등 총 명 승진실적 개선에 인사폭 확대보
2020-12-04,삼성전자하이닉스 또 신고가 경신
2020-12-04,삼성폰 원  업데이트간결한 디자인사용자 맞춤형 기능
2020-12-04,삼성 갤럭시 개인전투장비로 보급된다군 내년 시범도입
2020-12-04,이건희 별세 후 첫 삼성전자 임원 인사 코로나 위기속 성과주의세대교체 확인종합
2020-12-04,인사삼성전자 부사장 등 임원 명 승진
2020-12-04,삼성전자 부사장 명 대거 승진이재용 체제 강화세대교체 가속
2020-12-04,삼성전자 원    정식 업데이트 시작
2020-12-04,삼성 갤럭시  전술용으로 쓰인다내년 시범 도입
2020-12-04,반도체 빅사이클 온다삼성전자하이닉스 연일 강세
2020-12-04,프로필고승환 삼성전자 사업부 구매팀장 부사장
2020-12-04,프로필 이종열 삼성전자 메모리사업부 부사장
2020-12-04,삼성전자 원   업데이트 시작노태문 최상의 모바일 경험 제공
2020-12-04,삼성전자 코로나에도 명 임원 승진실적 개선 반영
2020-12-04,인사 삼성전자
2020-12-04,프로필 김학상 삼성전자 무선사업부 개발팀장 부사장
2020-12-04,인사 삼성전자
2020-12-04,삼성전자 소프트웨어 분야 첫 여성 전무 탄생  임원 명 승진
2020-12-04,프로필이종열 삼성전자 메모리사업부 개발팀장 부사장
2020-12-04,프로필윤장현 삼성전자 무선사업부  플랫폼팀장 부사장
2020-12-04,퇴근길 주가상승에 최대승진 축포훈훈한 삼성전자의 연말
2020-12-04,프로필한인택 삼성전자 종합기술원 재료연구센터장 부사장
2020-12-04,내 폰도 해당되나삼성  원   업데이트 시작
2020-12-04,삼성 노태문 체제 무선사업부 임원 승진 수익극대화  방점
2020-12-04,프로필이기수 삼성전자 생활가전사업부 개발팀장 부사장
2020-12-04,프로필김학상 삼성전자 무선사업부 개발팀장부사장
2020-12-04,인사삼성전자
2020-12-04,자식손자까지 돈 걱정 놓는다는데삼성 임원 되면 달라지는 가지
2020-12-04,프로필 윤보언 삼성전자 반도체연구소 공정개발실 펠로우
2020-12-04,삼성 프로필 고승환 삼성전자 사업부 구매팀장 부사장
2020-12-04,프로필황기현 삼성전자 반도체연구소 파운드리공정개발팀장 부사장
2020-12-04,삼성 프로필 이준희 삼성전자 네트워크사업부 부사장
2020-12-04,인사 삼성전자
2020-12-04,프로필이기수 삼성전자 생활가전사업부 부사장
2020-12-04,프로필 고승환 삼성전자 사업부 부사장
2020-12-04,프로필최방섭 삼성전자 법인 모바일 비즈니스장부사장
2020-12-04,삼성 프로필 황기현 삼성전자 반도체연구소 부사장
2020-12-04,프로필최승범 삼성리서치 기술전략팀장 부사장
2020-12-04,삼성 프로필 한인택 삼성전자 종합기술원 부사장
2020-12-04,프로필 이기수 삼성전자 생활가전사업부 개발팀장 부사장
2020-12-04,인사 삼성전자
2020-12-04,프로필이준희 삼성전자 네트워크사업부 선행개발그룹장부사장
2020-12-04,삼성 프로필 최승범 삼성전자 삼성리서치 부사장
2020-12-04,프로필윤장현 삼성전자 무선사업부  플랫폼 팀장부사장
2020-12-04,프로필윤태양 삼성전자 글로벌인프라총괄 평택사업장 부사장
2020-12-04,인도 홀린 삼성년 연속 신뢰받는 브랜드 톱
2020-12-04,프로필 이강협 삼성전자 생활가전사업부 부사장
2020-12-04,프로필 황기현 삼성전자 반도체연구소 부사장
2020-12-04,프로필 김학상 삼성전자 무선사업부 부사장
2020-12-04,프로필최승범 삼성리서치 기술전략팀장 부사장
2020-12-04,프로필 한인택 삼성전자 종합기술원 부사장
2020-12-04,프로필 이종열 삼성전자 메모리사업부 부사장
2020-12-04,프로필 윤장현 삼성전자 무선사업부 부사장
2020-12-04,프로필 최승범 삼성전자 삼성리서치 부사장
2020-12-04,만전자 된 삼성전자상승 여력 남았다
2020-12-04,코스피 단숨에 선삼성전자 만원 훌쩍
2020-12-04,갤럭시  싹 바뀐다삼성전자 원   정식 업데이트 시작
2020-12-04,삼성전자 원    정식 업데이트 시작
2020-12-04,삼성전자하이닉스   전공정 장비 투자 확대 나선다
2020-12-04,프로필 이석준 삼성전자 시스템사업부 부사장
2020-12-04,특징주 삼성전자 사흘째 사상 최고가 경신
2020-12-04,프로필삼성 금기호 외 전무급 명
2020-12-04,삼성 안드로이드 기반 원 업데이트 시작갤부터
2020-12-04,삼성전자 년 만에 최대 승진 축포불확실성 속 세대교체 준비종합
2020-12-04,에 미래 달렸다삼성 젊은 피 수혈
2020-12-04,삼성전자 만전자 넘어 만전자로목표가 만원  현대차증권
2020-12-04,만전자 넘어 만전자로증권사들 삼전 목표가 줄상향
2020-12-04,이재용의 소프트파워 강화 의지삼성전자 관련 인력 대거 승진
2020-12-04,삼성전자 안드 기반 원 업데이트 갤럭시부터 적용
2020-12-04,내년 고가폰 두뇌 될 스냅드래곤  삼성이 만든다
2020-12-04,프로필 정호진 삼성전자 한국총괄 영업팀장 전무
2020-12-04,삼성 프리미엄 에 미니  추가 는   아랫급으로 도전
2020-12-04,삼성전자 부사장 명 등 총 명 승진 임원 인사
2020-12-04,삼성전자 국내외 인증기관서 탄소배출 절감 인정받아
2020-12-04,특징주삼성전자 사흘 연속 최고가 경신
2020-12-04,이건희 신경영 키즈삼성 반도체 역대 번째 전무
2020-12-04,코로나 이긴 삼성전자 부문삼성 임원 승진 최대 수혜처
2020-12-04,혁신적직관적 경험 지속 창출삼성 갤럭시 원   업데이트
2020-12-04,삼성전자 주가 장중 만원 돌파
2020-12-04,삼성전자 장중 만원 돌파
2020-12-04,특징주 삼성전자 또 사상 최고가거래일 연속 경신
2020-12-04,강승준 재정관리관 삼성 주식 억어치 매각
2020-12-04,프로필 이기수 삼성전자 부사장
2020-12-04,명 중 명 유리천장 깬 삼성전자 신규 임원들
2020-12-04,차세대 전지 개발 삼성 김윤창 부사장 승진
2020-12-04,인사 삼성전자
2020-12-04,특징주삼성전자 이젠 만 전자 가나주 신고가 기록 경신
2020-12-04,삼성 화성사업장 협력사 직원 코로나 확진사무동 등 방역조치
2020-12-04,삼성전자에 하이닉스 현대차까지 줄줄이 신고가종합
2020-12-04,삼성전자 만전자 안착하나일 연속 신고가
2020-12-04,하이닉스 마이크론 가이던스 상향목표가 삼성
2020-12-04,삼성 갤럭시  원   업데이트 시작내 폰도 해당되나
2020-12-04,프로필 이준희 삼성전자 네트워크사업부 부사장
2020-12-04,특징주 만전자 된 삼성전자 만원선 돌파 거래일 연속 최고가
2020-12-04,만전자에 만닉스까지반도체 질주 이어지나
2020-12-04,삼성 프로필 최방섭 삼성전자 미국 법인 부사장
2020-12-04,인사 삼성전자
2020-12-04,프로필 최방섭 삼성전자 법인미국 모바일 비즈니스장 부사장
2020-12-04,삼성전자 년 임원인사 명 승진보
2020-12-04,프로필 안정수 삼성전기 부사장
2020-12-04,삼성전자 외국인여성 신임 승진 명  다양성포용성 강화
2020-12-04,최대 히트작 비스포크 주역에 힘 실어준 삼성 생활가전사업부서 부사장 명 승진
2020-12-04,프로필 최방섭 삼성전자 미국 법인 부사장
2020-12-04,삼성전자 원    정식 업데이트 시작
2020-12-04,인사 삼성전자 년 정기 임원인사 명단
2020-12-04,만원 넘은 삼성전자 사흘째 사상 최고가 경신
2020-12-04,만원 넘은 삼성전자 사흘째 사상 최고가 경신
2020-12-04,인사삼성전자삼성디스플레이삼성전기삼성에스원
2020-12-04,프로필 강석립 삼성 부사장
2020-12-04,종합코스피 사상 최고치에 삼성전자 방긋
2020-12-04,특징주 삼성전자 만원 돌파하이닉스 주 신고가
2020-12-04,특징주만 전자된 삼성전자 주 신고가 경신
2020-12-04,삼성과 한배 탄 퀄컴 스냅드래곤 로 새해  스마트폰 시장 공략
2020-12-04,프로필 스틴지아노 삼성전자 북미 총괄   부사장
2020-12-04,코스피 장중 선 돌파삼성전자도 사상최고가
2020-12-04,드디어 찍었다 만전자 환율은 원대로
2020-12-04,삼성전자전자 인도서 신뢰 받는 브랜드 톱 선정
2020-12-04,삼성 프로필 윤태양 삼성전자 글로벌인프라총괄 평택사업장 부사장
2020-12-04,속보 삼성전자 임원인사 총 명 승진
2020-12-04,빅데이터시장심리 톱 삼성전자하이닉스포스코대우조선해양
2020-12-04,프로필삼성 강석립 부사장
2020-12-04,시황종합 코스피  사상 첫 돌파 만전자 안착
2020-12-04,상위  승진 경쟁 뚫은 삼성전자 임원 보수도 억 소리 나네
2020-12-04,프로필 윤태양 삼성전자 글로벌인프라총괄 평택사업장 부사장
2020-12-04,삼성물산 삼성전자 평택  팹 마감 공사 수주
2020-12-04,삼성디스플레이 다음 주  시험생산 수율 향상 생산 단가 인하가 관건
2020-12-04,황성우 삼성 클라우드에 힘준다
2020-12-04, 만전자 안착하이닉스도 일째 신고가종합
2020-12-04,프로필조성순 삼성디스플레이 사업화팀 제조기술팀장 부사장
2020-12-04,삼성 정기 임원인사 부사장 명 전무 명 승진
2020-12-04,프로필 조성순 삼성디스플레이 사업화팀 부사장
2020-12-04,코스피 시대 왔다만전자 된 삼성전자
2020-12-04,속보 삼성전자 명 임원 승진고승환 등 핵심인재 명 부사장 발탁
2020-12-04,삼성 임원인사 단행고객 디지털 전환 주역 승진
2020-12-04, 반도체 제조사 마이크론 대만 공장 시간 넘게 정전
2020-12-04,코스피 사상 첫 장중 선 돌파종합
2020-12-04, 내년부터 개인전투장비로 갤럭시 스마트폰 도입
2020-12-04,바이 코리아 지속에 코스피 사상 첫 선 돌파종합
2020-12-04, 마이크론 정전에 삼전하이닉스 급등들어가도 될까
2020-12-04,실적 생활가전 확실한 보상외국인 임원승진 두자릿수
2020-12-04,갤 원  업데이트 시작노트폴드는 월
2020-12-04,신한카드 월 무이자 할부 혜택 제공
2020-12-04,램값 반등와중 마이크론 정전반도체 순풍
2020-12-04,트럼프  대기업 곳 또 블랙리스트 강경론 쐐기
2020-12-04,확 달라지는 갤럭시폰 일부터 전세계 업데이트
2020-12-04,코스피 도 돌파세계증시서 가장 핫
2020-12-04,끊임없는 갤노트 단종설갤에 펜 탑재 전망도
2020-12-04,종합 차기  후보군 두텁게 짠 이재용미래준비 포석
2020-12-04, 민간 스마트폰으로 전투 지휘한다
2020-12-04,질주하는 코스피 역대 최고치 선 돌파코스닥도  넘겨
2020-12-04,내년 디스플레이 시장 주인공은 롤러블미니
2020-12-04,상장 전 미리 찜하자장외 시장으로 몰리는 개미들
2020-12-04,코스피  돌파 거래일 만에 도 뚫었다
2020-12-04,이재용 성과주의로 미래  후보군 발탁대 전진배치종합
2020-12-04,코스피 사상 첫  돌파장초반  상승 선 직행
2020-12-04,반도체 첨병  계속 때리는 미국반도체 굴기 견제
2020-12-04,시그널  공모가 할인 강수 둔 알체라 일반 청약 흥행할까
2020-12-04,헤븐 노트야 가지마갤노트 단종설에 만 노트팬 웁니다
2020-12-04, 코스피 또 최고치내 종목은 왜 안 오르지
2020-12-04,대한민국 소프트웨어 대상에 와이즈넛    
2020-12-04,군용 갤럭시 로 전투지휘육군해병대 내년 도입
2020-12-04,코스피 사상 최초 선 돌파환율은 원대 붕괴
2020-12-04,세계 위 램 제조사 마이크론 공장 한시간 정전램 공급에 악영향
2020-12-04,하이닉스 만원 육박외국인 매수세에 연일 신고가
2020-12-04,폴더블롤러블폰 정체된 시장 돌파구 될까
2020-12-04,마감시황코스피 사상 첫 선 돌파반도체달러가 이끌었다
2020-12-04,프로필 조성순 사업화팀 제조기술팀장 부사장
2020-12-04,역대 최고 코스피 산타랠리 이어간다
2020-12-04,산업단지 인근 아파트 선호 용인인천 등 이달 신규 분양
2020-12-04,주식 초고수는 지금셀트리온 삼형제 매수매도 최다
2020-12-04,성냥갑 만 해 더 작아진 갤플립 이렇게 생겼다 선빵
2020-12-04,혁신 부르는 오픈 소스는 필수
2020-12-04,연일 기록 세우는 코스피곱버스 투자한 개인 한달 손실만 
2020-12-04,코스피 장중 선 돌파 외국인동학개미 사자 행진
2020-12-04,프로필이강협 생활가전사업부 전략마케팅팀장 부사장
2020-12-04,부산에코델타스마트시티 깜깜이 사업자 선정 과정 논란
2020-12-04,보급 년 걸리던 군이 변했다갤럭시 군용통신장비로 채택
2020-12-04,오늘의 목표주가 산업 살아난다삼전하이닉스이노텍 
2020-12-04,프로필 한인택 종합기술원 재료연구센터장 부사장
2020-12-04,프로필 이석준 시스템 사업부 개발실장 부사장
2020-12-04,프로필최방섭 북미총괄   장 부사장
2020-12-04,연일 사상 최고가 쓰는 코스피 선 마감종합
2020-12-04,프로필이기수 생활가전사업부 개발팀장 부사장
2020-12-04,프로필 황기현 반도체연구소 파운드리 공정개발팀장 부사장
2020-12-04,프로필한인택 종합기술원 연구센터장 부사장
2020-12-04,영국은 비욘세 상장펀드 조 넘는데한국은  공모펀드 
2020-12-04,마이크론 정전사고에램 가격 반등 빨라지나종합
2020-12-04,마켓뷰 파죽지세 코스피 사상 처음  넘었다
2020-12-04,베트남 하늘길 기업인에 활짝 열린다경제계 환영
